ProjectName,MeetingType,MeetingDate,MeetingYear,Status,ActionTaken,StartTime,StaffCode,Title,MinutesURL,DocDate,LocationName,Latitude,Longitude
Corkscrew Road,Regular Council Meeting,2024-01-03,2024,Accepted,"Approved agenda | Approved consent agenda | Adopted the Village of Estero Information Security Policy | Accepted a payment of $30,000 from ProEnergy, LLC, in compromise of the Village's code enforcement lien on the owner's property at 8800 Corkscrew Road, and to authorize the Village Manager or his designee to file a release of lien once the payment has been made | Approved Contract EC 2024-07 with Johnson Engineering, Inc. to prepare the Village Wide Traffic Study for $249,480, approve a $25,000 contingency for additional services that may be required to complete the project, authorize the Village Manager to sign the contract and other additional implementing documents within the scope of the contract on behalf of the Village of Estero Council, and authorize the Village Manager to execute an amendment to the agreement to add the locations added by council. Vice Mayor Ribble would like to add the intersection Meadowbrook and Coconut to the study. Councilmember Zalucki would like to add the intersections Corkscrew and Estero Crossing Blvd and Corkscrew and Bella Terra Blvd to the study | Approved contract EC 2024-06 with Florida Acquisition Services to provide right-of-way acquisition services to the Village of Estero and authorize the Village Manager to sign the contract and other implementing documents within the scope of the contract on behalf of the Village of Estero Council | Approved Change Order No. 1 in the amount of $8,500.00 to Contract EC 2022-83 with National Water",9:30 am,ON/CO,Village Council Meeting Minutes — 2024-01-03,https://estero-fl.gov/wp-content/uploads/library-ada/minutes/2024%20Minutes/01032024%20minutes.pdf,2024-01-03,Corkscrew Road Widening Corridor,26.436300,-81.770100
Corkscrew Road,Regular Council Meeting,2024-01-03,2024,Accepted,"Approved agenda | Approved consent agenda | Adopted the Village of Estero Information Security Policy | Accepted a payment of $30,000 from ProEnergy, LLC, in compromise of the Village's code enforcement lien on the owner's property at 8800 Corkscrew Road, and to authorize the Village Manager or his designee to file a release of lien once the payment has been made | Approved Contract EC 2024-07 with Johnson Engineering, Inc. to prepare the Village Wide Traffic Study for $249,480, approve a $25,000 contingency for additional services that may be required to complete the project, authorize the Village Manager to sign the contract and other additional implementing documents within the scope of the contract on behalf of the Village of Estero Council, and authorize the Village Manager to execute an amendment to the agreement to add the locations added by council. Vice Mayor Ribble would like to add the intersection Meadowbrook and Coconut to the study. Councilmember Zalucki would like to add the intersections Corkscrew and Estero Crossing Blvd and Corkscrew and Bella Terra Blvd to the study | Approved contract EC 2024-06 with Florida Acquisition Services to provide right-of-way acquisition services to the Village of Estero and authorize the Village Manager to sign the contract and other implementing documents within the scope of the contract on behalf of the Village of Estero Council | Approved Change Order No. 1 in the amount of $8,500.00 to Contract EC 2022-83 with National Water",9:30 AM,TD/CS,Village Council Meeting Minutes — 2024-01-03,https://estero-fl.gov/wp-content/uploads/library-ada/minutes/2024%20Minutes/01032024%20minutes.pdf,2024-01-03,Corkscrew Rd / Puente Lane,26.431200,-81.784700
General Council Business,Regular Council Meeting,2016-06-08,2016,Accepted,"Approved the agenda as revised: pulled agenda item 3 (b) from the Consent Agenda and rescheduled for the January 18, 2017 Council meeting; removed agenda item 10 (b) and delayed discussion until it is determined whether there will be a Village election in March | Approved the consent agenda as revised; agenda item 3 pulled and rescheduled for the January 18, 2017 meeting | Adopted Resolution No. 2017-02 | Adopted Resolution No. 2017-03 and approved the agreement between the Village and Pritchard Construction LLC as amended | Approved the Traffic Signal Maintenance Agreement with Lee County | Passed first reading and set second reading and public hearing date for January 18, 2017 | Passed second reading and adopted Ordinance No. 2016-15 | Passed second reading and adopted Ordinance No. 2016-16",9:30 am,DA/MI,Village Council Meeting Minutes — 2016-06-08,https://estero-fl.gov/wp-content/uploads/library-ada/minutes/2017%20Minutes/Council/010417%20Council%20Meeting%20Approved%20Minutes.pdf,2017-01-04,Estero Village Hall,26.428500,-81.806800
General Council Business,Regular Council Meeting,2023-01-18,2023,Accepted,"Motion to permit Councilmember Ribble to participate remotely in Zoom Presentation | Approved agenda | Approved the Consent Agenda | Approved Change Order #1 to Contract EC 2019-36 in the amount of $46,980 with Coastal Engineering Consultants, Inc. for additional work required to address environmental permit application questions from the Florida Department of Environmental Protection for the proposed dredging of sediments from the Estero River | Accepted the Village's portion of the Opiod Settlement in the amount of $14,400",9:30 am,ON/CO,Village Council Meeting Minutes — 2023-01-18,https://estero-fl.gov/wp-content/uploads/library-ada/minutes/2023%20MINUTES/01042023%20minutes.pdf,2023-01-04,Estero Village Hall,26.428500,-81.806800
General Council Business,Regular Council Meeting,2016-01-20,2016,Accepted,Approved the agenda | Approved the Consent Agenda | Approved first reading of Ordinance No. 2016-01 | Adopted Resolution No. 2016-01 | Adopted Resolution No. 2016-02 | Adopted Resolution No. 2016-03,9:30 am,DA/MI,Village Council Meeting Minutes — 2016-01-20,https://estero-fl.gov/wp-content/uploads/library-ada/minutes/2016%20Minutes/Council/01062016%20minutes.pdf,2016-01-06,Estero Village Hall,26.428500,-81.806800
General Council Business,Regular Council Meeting,2025-01-22,2025,Accepted,"Approved agenda | Approved consent agenda | Approved award of Task Authorization 14 to Contract EC 2022-38 to Johnson Engineering to provide water monitoring services for The Village of Estero for $193,411, approve a $19,000 contingency for additional services that may be required to complete the project, and authorize the Village Manager to sign the STA and other additional implementing documents within the scope of the STA on behalf of the Village of Estero Council | Passed first reading and schedule second reading for February 5, 2025 and the applicant will provide us with additional information | Passed first reading and schedule second reading for January 22, 2025",9:30 am,DA/MI,Village Council Meeting Minutes — 2025-01-22,https://estero-fl.gov/wp-content/uploads/library-ada/minutes/2025%20Minutes/Council/01082025%20minutes.pdf,2025-01-08,Estero Village Hall,26.428500,-81.806800
General Council Business,Special Called Meeting,2016-02-10,2016,Accepted,"Directed Village Land Use Attorney Nancy Stroud to investigate the merits of an annexation challenge, a DRI challenge, and Comprehensive Plan challenge, with traffic analysis; further review of coastal high hazard area implication; directed staff to engage with the county regarding partnering with the Village to try to find a solution; engage a traffic engineer and bring information back, including budget implication, to Council at the next meeting | Continued deliberations to 9:00 a.m. on January 20, 2016",9:30 am,DA/MI,Village Council Meeting Minutes — 2016-02-10,https://estero-fl.gov/wp-content/uploads/library-ada/minutes/2016%20Minutes/Council/01132016%20minutes.pdf,2016-01-13,Estero Village Hall,26.428500,-81.806800
General Council Business,Regular Council Meeting,2021-01-13,2021,Accepted,No action found,9:30 am,DA/MI,Village Council Meeting Minutes — 2021-01-13,https://estero-fl.gov/wp-content/uploads/library-ada/minutes/2021%20Minutes/COUNCIL/01132021%20Minutes.pdf,2021-01-13,Estero Village Hall,26.428500,-81.806800
General Council Business,Regular Council Meeting,2021-02-17,2021,Accepted,"Approved to permit Councilmembers Levitan, and Wilson to participate remotely in Zoom Presentation, and to combine agenda items 7(a)/6(b) | Approved the Consent Agenda | Approved Motion to approve award of Request for Bid No. RFB 2021-01, Mowing, Landscape, and Irrigation Maintenance for the Village of Estero to P & T Lawn and Tractor Service, Inc. to provide mowing, landscape, and irrigation maintenance services as provided in the contract for a one-year period, at a rate of $127,075.00 per year, authorize the Village Manager to renegotiate and execute the renewal of this contract for three additional one year terms under the same terms and conditions, which would include adding Estero Parkway maintenance and US 41 maintenance, if doing so is in the best interest of the Village of Estero, approve a contingency fund amount of $13,000 (10% contingency) to cover unforeseen circumstances which may occur, and authorize the Village Manager to execute the contract documents on behalf of the Village of Estero Council | Approved Ordinance 2020-11 with the change to Section 2, adding one additional condition that says the Village Manager may waive the agreement that the traffic light be operational prior to the first certificate of completion for the vertical development, if the Village Manager determines that the light will be operational within four months | Motion to approve Estero Crossing - Corkscrew Road/Puente Lane Traffic Signal Agreement with the revision to remove the last s",9:30 am,DA/MI,Village Council Meeting Minutes — 2021-02-17,https://estero-fl.gov/wp-content/uploads/library-ada/minutes/2021%20Minutes/COUNCIL/01202021%20minutes.pdf,2021-01-20,Estero Village Hall,26.428500,-81.806800
General Council Business,Regular Council Meeting,2024-01-24,2024,Accepted,"Approved agenda | Approved consent agenda | Approved Interlocal Agreement for Election Services with the Supervisor of Elections | Approved EC 2024-10 in the amount of $151,440 for CW3 Engineering, Inc. to provide construction engineering and inspection services for the Estero on the River Phase 1 Improvements, approve a $15,000 contingency for additional services that may be required to complete the project and authorize the Village Manager to sign the contract and other additional implementing documents within the scope of the contract on behalf of the Village of Estero Council, and to approve and execute and subsequent amendments which do not require an increase in the not to exceed budget (with contingency) | Approved EC 2024-09 in the amount of $490,560.65 for HighSpans Engineering, Inc. to provide construction engineering and inspection services for the Sandy Lake Bike/Ped Improvements, approve a $49,000 contingency for additional services that may be required to complete the project, and authorize the Village Manager to sign the contract and other additional implementing documents within the scope of the contract on behalf of the Village of Estero Council, and to approve and execute and subsequent amendments which do not require an increase in the not to exceed budget (with contingency) | Adopted Resolution No. 2024-02 | Approved Agreement of Purchase and Sale Agreement for the purchase of 20897 Three Oaks Parkway | Approved Recreation Lease Agreement with the Lee Coun",9:30 am,ON/CO,Village Council Meeting Minutes — 2024-01-24,https://estero-fl.gov/wp-content/uploads/library-ada/minutes/2024%20Minutes/01242024%20minutes.pdf,2024-01-24,Estero Village Hall,26.428500,-81.806800
General Council Business,Regular Council Meeting,2021-01-27,2021,Accepted,"Approved to permit Councilmembers Levitan, Wilson, and McLain to participate remotely in Zoom Presentation | Approved agenda | Approved Resolution No. 2021-01 | Adopted the Land Development Code Ordinance 2020-10 and Official Zoning Map as amended in the ""Addendum of Recommended Changes"" document dated January 19, 2021 as well as the addition of a sentence to Table 3-405.C that states ""A stand-alone car wash which has applied but has not been determined to be complete for an application for Development Order prior to January 27, 2021, and which submits a complete application for Development Order prior to April 27, 2021, a permitted use and not a special exception use shall apply.""",9:30 am,DA/MI,Village Council Meeting Minutes — 2021-01-27,https://estero-fl.gov/wp-content/uploads/library-ada/minutes/2021%20Minutes/COUNCIL/01272021%20minutes.pdf,2021-01-27,Estero Village Hall,26.428500,-81.806800
General Council Business,Regular Council Meeting,2021-01-06,2021,Accepted,"Approved agenda | Approved the Consent Agenda | Estero Chamber of Commerce approval of financial support for Strategic Plans for Future Growth and Impact. Staff Presentation/Comments: Steve Sarkozy, Village Manager Council Questions or Comments: Councilmember McLain and Mayor Ribble Public Comment: None | Approved motion for financial support Estero Chamber of Commerce Strategic Plans for Future Growth and Impact | Passed first reading of Ordinance No. 2020-11 and schedule second reading/public hearing for January 20, 2020 | Passed first reading of Ordinance No. 2021-01 and schedule second reading/public hearing for January 20, 2020 | Approved motion for a continuance until February 3 with the goal of making a final decision | Adopted Ordinance 2020-07",9:30 am,DA/MI,Village Council Meeting Minutes — 2021-01-06,https://estero-fl.gov/wp-content/uploads/library-ada/minutes/2021%20Minutes/COUNCIL/0162021%20Minutes.pdf,2021-01-06,Estero Village Hall,26.428500,-81.806800
General Council Business,Regular Council Meeting,2023-02-15,2023,Accepted,"Motion to permit Councilmember Wilson to participate remotely in Zoom Presentation | Approved agenda | Approved the Consent Agenda | Passed first reading of Zoning Ordinance 2023-01 and set second reading for February 15, 2023",9:30 am,ON/IN,Village Council Meeting Minutes — 2023-02-15,https://estero-fl.gov/wp-content/uploads/library-ada/minutes/2023%20MINUTES/02012023%20minutes.pdf,2023-02-01,Estero Village Hall,26.428500,-81.806800
Septic to Sewer,Regular Council Meeting,2022-02-16,2022,Accepted,"Approved to permit Village Attorney Burt Saunders to participate remotely in Zoom Presentation | Approved agenda | Approved the Consent Agenda | Adopted Resolution No. 2022-02 | Approved the consultants ranking for Sandy Lane and Broadway East Bicycle/Pedestrian Improvements Project as follows: Number 1 - Atkins North America, Inc.; Number 2 - CW3 Engineering, Inc.; Number 3 - Kimley-Horn and Associates, Inc.; Number 4 - Q. Grady Minor & Associates, P.A., and authorize staff to negotiate a contract with the Number 1 ranked firm, Atkins North America, Inc. to provide professional consulting services for the Sandy Lane and Broadway East Bicycle/Pedestrian Improvements Project | Approved the consultants ranking for Broadway Avenue West Utilities Extension Project (UEP) as follows: Number 1 - Johnson Engineering, Inc.; Number 2 - Tetra Tech, Inc.; Number 3 - CW3 Engineering, Inc.; Number 4 - JR Evans Engineering, P.A., and authorize staff to negotiate a contract with the Number 1 ranked firm, Johnson Engineering, Inc. to provide professional consulting services for the Broadway Avenue West Utilities Extension Project (UEP) | Approved the consultants ranking for Broadway Avenue East Utilities Extension Project (UEP) as follows: Number 1 - Tetra Tech, Inc.; Number 2 - Johnson Engineering, Inc.; Number 3 - CW3 Engineering, Inc.; Number 4 - JR Evans Engineering, P.A., and authorize staff to negotiate a contract with the Number 1 ranked firm, Tetra Tech, Inc. to provide professional c",9:30 am,DA/MI,Village Council Meeting Minutes — 2022-02-16,https://estero-fl.gov/wp-content/uploads/library-ada/minutes/2022%20MINUTES/COUNCIL/02022022%20minutes.pdf,2022-02-02,Broadway Avenue East UEP,26.442000,-81.805400
General Council Business,Regular Council Meeting,2025-02-19,2025,Accepted,"Approved agenda with the deletion of 6 (b) | Approved consent agenda | Approved Resolution No. 2025-01 to reappoint two (2) Planning, Zoning, and Design Board members for a one-year term | Adopted Ordinance No. 2024-14 with staff revisions",9:30 am,ON/CO,Village Council Meeting Minutes — 2025-02-19,https://estero-fl.gov/wp-content/uploads/library-ada/minutes/2025%20Minutes/Council/02052025.pdf,2025-02-05,Estero Village Hall,26.428500,-81.806800
Corkscrew Road,Regular Council Meeting,2024-02-21,2024,Accepted,"Approved agenda | Approved consent agenda | Approved schedule for Planning Zoning and Design Board appointments | Adopted Resolution No. 2024-03 | Approved EC 2024-06 STA -02 in the amount of $47,200 for Florida Acquisition & Appraisal Inc. to provide easement acquisition services for the Sandy Lane Bike/Ped Improvements Project, approve a $4,700 contingency for additional services that may be required to complete the project, and authorize the Village Manager to sign the contract and other additional implementing documents within the scope of the contract on behalf of the Village of Estero Council, and to approve and execute any subsequent amendments which do not require an increase in the not to exceed budget (with contingency) | Approved EC 2024-06 STA-03 in the amount of $200,600 for Florida Acquisition & Appraisal Inc. to provide easement acquisition services for the River Ranch Road Improvements Project, approve a $20,000 contingency for additional services that may be required to complete the project, and authorize the Village Manager to sign the contract and other additional implementing documents within the scope of the contract on behalf of the Village of Estero Council, and to approve and execute any subsequent amendments which do not require an increase in the not to exceed budget (with contingency) | Approved EC 2019-66 STA-42 in the amount of $236,405 for P & T Lawn & Tractor Services, Inc. to install landscaping along US 41 from Williams Road to south of Estero",9:30 am,ON/CO,Village Council Meeting Minutes — 2024-02-21,https://estero-fl.gov/wp-content/uploads/library-ada/minutes/2024%20Minutes/02072024%20minutes.pdf,2024-02-07,Corkscrew Road Widening Corridor,26.436300,-81.770100
General Council Business,Regular Council Meeting,2016-03-16,2016,Accepted,"Approved the agenda | Approved the Consent Agenda, revising minutes as necessary | Authorized staff to distribute RFQ 2016-01 | Authorized staff to distribute RFP 2016-01 | Authorized staff to distribute RFP 2016-02 | Appointed Robert King as Village CAC Representative to MPO | Accepted the letter of resignation from Jeffrey Mass dated January 12, 2016 and directed the Village Clerk to advertise the vacancy and solicit applications | Adopted Resolution 2016-05 as amended | Authorized the Mayor to sign the letter and approved and endorsed the white paper entitled ""Caloosahatchee Watershed Regional Water Management Issues."" | Adopted Resolution No. 2016-04",9:30 am,DA/MI,Village Council Meeting Minutes — 2016-03-16,https://estero-fl.gov/wp-content/uploads/library-ada/minutes/2016%20Minutes/Council/021016%20Council%20Regular%20Meeting%20Approved%20Minutes.pdf,2016-02-10,Estero Village Hall,26.428500,-81.806800
General Council Business,Regular Council Meeting,2022-02-16,2022,Accepted,Approved agenda | Approved the Consent Agenda | Approved the 2021-2022 Interlocal Agreement between Village of Estero and Lee County for Stray Animal Control Services,9:30 am,ON/CO,Village Council Meeting Minutes — 2022-02-16,https://estero-fl.gov/wp-content/uploads/library-ada/minutes/2022%20MINUTES/COUNCIL/02162022%20minutes.pdf,2022-02-16,Estero Village Hall,26.428500,-81.806800
BERT Rail Trail,Regular Council Meeting,2024-02-21,2024,Accepted,"Approved agenda | Approved consent agenda | Approved a perpetual sidewalk easement agreement with GL Homes to obtain an easement for the path along the River Creek Community and pay GL Homes $104,994.23 after they build the path using asphalt as the material, approve a $10,000 contingency for additional services that may be required to complete the project, and authorize the Village Manager to sign the sidewalk easement agreement and other additional implementing documents within the scope of the agreement on behalf of the Village of Estero Council | Passed first reading of Ordinance No. 2024-03 and set second reading for March 6, 2024",9:30 am,ON/CO,Village Council Meeting Minutes — 2024-02-21,https://estero-fl.gov/wp-content/uploads/library-ada/minutes/2024%20Minutes/02212024%20minutes.pdf,2024-02-21,BERT Rail Trail Corridor,26.433900,-81.815700
General Council Business,Regular Council Meeting,2021-02-24,2021,Accepted,"Approved motion to excuse Councilmember Wilson's absence | Approved agenda | Approved Resolution No. 2021-02 and authorize the Village to modify the Resolution if needed | Approved motion to conclude interviews, and schedule the item at the March 3rd meeting, where a final decision will be made",9:30 am,DA/MI,Village Council Meeting Minutes — 2021-02-24,https://estero-fl.gov/wp-content/uploads/library-ada/minutes/2021%20Minutes/COUNCIL/02242021%20minutes.pdf,2021-02-24,Estero Village Hall,26.428500,-81.806800
Corkscrew Road,Regular Council Meeting,2021-03-03,2021,Accepted,"Approved to permit Councilmembers Levitan and Wilson to participate remotely in Zoom Presentation | Approved agenda with the moving items of 7A and 8A up to be heard after the Consent Agenda | Approved the Consent Agenda | Denied request to amend the zoning for the Estero Town Center CPD for a Firestone Complete Auto Care, and adopt Ordinance 2020-09 | Approved the Williams Road Bicycle and Pedestrian Improvements - Concept Design contract with Banks Engineering under Supplemental Task Authorization (STA) - 01 Contract EC 2020-56 Miscellaneous Professional Services to perform a suite of design services for the Bicycle & Pedestrian improvements along Williams Road, between US 41 and Three Oaks Parkway, approve a 10% contingency for additional services that may be required to complete the project, and authorize the Village Manger to sign the STA and other additional implementing documents within the scope of the STA on behalf of the Village of Estero Council | Approved Ben Hill Griffin Parkway Preliminary Landscape Design contracts with Bruce Howard and Associates under EC2020-42 and RWA Engineering under EC2020-67 to perform a suite of design services for the proposed landscape improvements along Ben Hill Griffin Parkway from Corkscrew Road to Estero Parkway, approve a 10% contingency for additional services that may be required to complete the project, and Authorize the Village Manager to sign the Supplemental Task Authorization (STA) and other additional implementing documen",9:30 am,DA/MI,Village Council Meeting Minutes — 2021-03-03,https://estero-fl.gov/wp-content/uploads/library-ada/minutes/2021%20Minutes/COUNCIL/0232021%20minutes.pdf,2021-02-03,Corkscrew Road Widening Corridor,26.436300,-81.770100
General Council Business,Regular Council Meeting,2023-03-15,2023,Accepted,"Motion to permit Councilmember Wilson to participate remotely in Zoom Presentation | Approved agenda with moving workshop 12a to item 3b | Approved the Consent Agenda items a, b, and c | Approves Supplemental Task Authorization (STA)-34 under contract EC 2019-06 to P & T Lawn and Tractor Service, Inc. to construct and install a monument sign on US 41 at a total cost of $69,968, approve a contingency fund amount of $7,000 (an amount equal to 10% of the total project cost) to cover unforeseen circumstances which may occur, and authorize the Village Manager to execute the STA on behalf of the Village of Estero Council | Approved Ordinance No. 2023-02 the recommended changes made by the Planning Zoning and Design Board",9:30 am,ON/CO,Village Council Meeting Minutes — 2023-03-15,https://estero-fl.gov/wp-content/uploads/library-ada/minutes/2023%20MINUTES/03012023%20minutes.pdf,2023-03-01,Estero Village Hall,26.428500,-81.806800
General Council Business,Regular Council Meeting,2024-03-20,2024,Accepted,"Approved agenda | Approved consent agenda | Approved EC 2024-26 in the amount of $1,967,667 for Hellas Construction, Inc. to install artificial turf on The Jeff Sommer Stadium football field, approve a $197,000 contingency for additional services that may be required to complete the project, and authorize the Village Manager to sign the contract and other additional implementing documents within the scope of the contract on behalf of the Village of Estero Council, and to approve and execute any subsequent amendments which do not require an increase in the not to exceed budget (with contingency) | Approved the attached Professional Services agreement with Vieste, LLC | Passed first reading of Ordinance No. 2024-01 and set second reading for March 20, 2024 | Passed first reading of Ordinance No. 2024-02 and set second reading for March 20, 2024 | Passed first reading of Ordinance No. 2024-04 and set second reading for March 20, 2024 | Adopted Ordinance No. 2024-03 subject to changing the word enforcement to compliance",9:30 am,DA/MI,Village Council Meeting Minutes — 2024-03-20,https://estero-fl.gov/wp-content/uploads/library-ada/minutes/2024%20Minutes/03062024%20minutes.pdf,2024-03-06,Estero Village Hall,26.428500,-81.806800
General Council Business,Public Hearing,2016-04-06,2016,Accepted,"Approved continuing to a date certain, March 23, 2016",9:30 am,DA/MI,Village Council Meeting Minutes — 2016-04-06,https://estero-fl.gov/wp-content/uploads/library-ada/minutes/2016%20Minutes/Council/030916%20Zoning%20Hearing%20Approved%20Minutes.pdf,2016-03-09,Estero Village Hall,26.428500,-81.806800
