RecordId,SourceBoard,DataGrain,RecordType,MeetingId,ItemId,MotionId,Board,MeetingFormat,MeetingType,MeetingDate,MeetingYear,MeetingTime,MeetingVenue,Status,AgendaItemNumber,AgendaItemType,FactCategory,LandUseCategory,ProjectName,ProjectTitle,Summary,ApplicationId,ApplicationType,ApplicantName,District,StaffCode,ActionTaken,Outcome,MotionText,ProposedBy,SecondedBy,VoteResult,VoteYes,VoteNo,VoteAbstain,AddressRaw,AddressNormalized,LocationName,Latitude,Longitude,GeocodeConfidence,LocationGrain,ParcelId,PrimarySourceUrl,SourceFilename,ExtractionMethod,ExtractionConfidence,ReviewRequired,ReviewReason,AiReady,CitationText
council:1129,council,agenda_item,AgendaItemLocation,232,1129,1013,Village Council,Regular Meeting,Village Council,2024-05-15,2024,9:30 am,Estero Village Hall,Accepted,3,Resolution,legislative_resolution,infrastructure,Corkscrew Road,"Resolution No. 2024-05 Corkscrew Pines Replat (PLT2022-E004) A Resolution of The Village Council of the Village of Estero, Florida, Approving Corkscrew Pines Replat of Tracts A, B, C, D, F, H and I of Stoneybrook Unit 8 Located on Corkscrew Road,...","Resolution No. 2024-05 Corkscrew Pines Replat (PLT2022-E004) A Resolution of The Village Council of the Village of Estero, Florida, Approving Corkscrew Pines Replat of Tracts A, B, C, D, F, H and I of Stoneybrook Unit 8 Located on Corkscrew Road, As Recor. Action: Approved Resolution No. 2024",Resolution No. 2024-05,resolution,,,TD/CS,Approved Resolution No. 2024,Approved Resolution No. 2024,Approved Resolution No. 2024,,,Detected,,,,"Corkscrew Pines project site, Estero, FL","Corkscrew Pines project site, Estero, FL","Corkscrew Pines project site, Estero, FL",26.4383,-81.7603,1.0,item_address,,https://estero-fl.gov/wp-content/uploads/library-ada/minutes/2024%20Minutes/05152024%20minutes.pdf,05152024 minutes.pdf,pdf_extraction:council,low,true,Review item 1127: weak or fallback extraction.; Review item 1128: weak or fallback extraction.; Review item 1130: weak or fallback extraction.; Review item 1131: weak or fallback extraction.; Review item 1132: weak or fallback extraction.,false,"Village Council meeting on 2024-05-15, agenda item 3 (Resolution): Approved Resolution No. 2024 Source: https://estero-fl.gov/wp-content/uploads/library-ada/minutes/2024%20Minutes/05152024%20minutes.pdf"
pzdb:77,pzdb,agenda_item,AgendaItemLocation,27,77,,Planning Zoning & Design Board,Regular Meeting,Planning Zoning & Design Board,2024-05-14,2024,4:31 pm,Estero Village Hall,Accepted,5,Unknown,other,commercial,8111 Broadway East (Old Post Office) Zoning Amendment (DCI2024-E001) (District 4) The 1-acre site is located 200 feet east of US 41 on property originally developed by the U.S. Federal Government for a Post Office,8111 Broadway East (Old Post Office) Zoning Amendment (DCI2024-E001) (District 4) The 1-acre site is located 200 feet east of US 41 on property originally developed by the U.S. Federal Government for a Post Office,8111 Broadway East (Old Post Office) Zoning Amendment (DCI2024-E001) (District 4) The 1-acre site is located 200 feet east of US 41 on property originally developed by the U.S. Federal Government for a Post Office. Action: Recommended approval to Village Council with staff conditions and one additional condition that the color palette be consistent with the rendering,DCI2024-E001,development_compliance_inspection,,4,,Recommended approval to Village Council with staff conditions and one additional condition that the color palette be consistent with the rendering,Recommended approval to Village Council with staff conditions and one additional condition that the color palette be consistent with the rendering,,,,See minutes,,,,"8111 Broadway Avenue East, Estero, FL","8111 Broadway Avenue East, Estero, FL","8111 Broadway Avenue East, Estero, FL",26.44244610632,-81.809993666508,1.0,item_address,,https://raw.githubusercontent.com/EagleGIS-FGCU/EagleGIS/main/data/raw/pzdb/2024/20240514%20PZDB%20Minutes.pdf,20240514 PZDB Minutes.pdf,pdf_extraction:pzdb,high,false,,true,"Planning Zoning & Design Board meeting on 2024-05-14, agenda item 5 (Unknown): Recommended approval to Village Council with staff conditions and one additional condition that the color palette be consistent with the rendering Source: https://raw.githubusercontent.com/EagleGIS-FGCU/EagleGIS/main/data/raw/pzdb/2024/20240514%20PZDB%20Minutes.pdf"
pzdb:76,pzdb,agenda_item,AgendaItemLocation,27,76,50,Planning Zoning & Design Board,Regular Meeting,Planning Zoning & Design Board,2024-05-14,2024,4:31 pm,Estero Village Hall,Accepted,4,Vote,board_vote,infrastructure,The Brooks Commons Club - Pickleball Expansion (Amendment to LDO2022-E051) (District 6) The Commons Club is located at 9920 Coconut Road. The courts are west of the club along Coconut Road. Applicant is seeking to revise the original plan presente...,The Brooks Commons Club - Pickleball Expansion (Amendment to LDO2022-E051) (District 6) The Commons Club is located at 9920 Coconut Road. The courts are west of the club along Coconut Road. Applicant is seeking to revise the original plan presente...,The Brooks Commons Club - Pickleball Expansion (Amendment to LDO2022-E051) (District 6) The Commons Club is located at 9920 Coconut Road. The courts are west of the club along Coconut Road. Applicant is seeking to revise the original plan presented to the. Action: Approved the Limited Development Order Amendment with staff stipulations,LDO2022-E051,land_development_order,,6,,Approved the Limited Development Order Amendment with staff stipulations,Approved the Limited Development Order Amendment with staff stipulations,Approved the Limited Development Order Amendment with staff stipulations,,,See minutes,7,1,,"Commons Club at The Brooks, Estero, FL","Commons Club at The Brooks, Estero, FL","Commons Club at The Brooks, Estero, FL",26.3974648,-81.7889557,1.0,item_address,,https://raw.githubusercontent.com/EagleGIS-FGCU/EagleGIS/main/data/raw/pzdb/2024/20240514%20PZDB%20Minutes.pdf,20240514 PZDB Minutes.pdf,pdf_extraction:pzdb,high,false,,true,"Planning Zoning & Design Board meeting on 2024-05-14, agenda item 4 (Vote): Approved the Limited Development Order Amendment with staff stipulations Source: https://raw.githubusercontent.com/EagleGIS-FGCU/EagleGIS/main/data/raw/pzdb/2024/20240514%20PZDB%20Minutes.pdf"
pzdb:75,pzdb,agenda_item,AgendaItemLocation,27,75,49,Planning Zoning & Design Board,Regular Meeting,Planning Zoning & Design Board,2024-05-14,2024,4:31 pm,Estero Village Hall,Accepted,3,Vote,board_vote,infrastructure,"Wildcat Run Pickleball- Limited Development Order (LDO2024-E002) (District 7) 20300 Country Club Drive, south of Corkscrew Road and immediately west of RiverCreek. Applicant is seeking to renovate 1 of the 5 existing tennis courts into 4 new pickl...","Wildcat Run Pickleball- Limited Development Order (LDO2024-E002) (District 7) 20300 Country Club Drive, south of Corkscrew Road and immediately west of RiverCreek. Applicant is seeking to renovate 1 of the 5 existing tennis courts into 4 new pickl...","Wildcat Run Pickleball- Limited Development Order (LDO2024-E002) (District 7) 20300 Country Club Drive, south of Corkscrew Road and immediately west of RiverCreek. Applicant is seeking to renovate 1 of the 5 existing tennis courts into 4 new pickleball co. Action: Approved the Limited Development Order with staff stipulations",LDO2024-E002,land_development_order,,7,,Approved the Limited Development Order with staff stipulations,Approved the Limited Development Order with staff stipulations,Approved the Limited Development Order with staff stipulations,,,See minutes,7,1,,20300 Country Club Drive,"20300 Country Club Drive, Estero, FL","20300 Country Club Drive, Estero, FL",26.436910613643,-81.74953793257,1.0,item_address,,https://raw.githubusercontent.com/EagleGIS-FGCU/EagleGIS/main/data/raw/pzdb/2024/20240514%20PZDB%20Minutes.pdf,20240514 PZDB Minutes.pdf,pdf_extraction:pzdb,high,false,,true,"Planning Zoning & Design Board meeting on 2024-05-14, agenda item 3 (Vote): Approved the Limited Development Order with staff stipulations Source: https://raw.githubusercontent.com/EagleGIS-FGCU/EagleGIS/main/data/raw/pzdb/2024/20240514%20PZDB%20Minutes.pdf"
pzdb:74,pzdb,agenda_item,AgendaItemLocation,27,74,48,Planning Zoning & Design Board,Regular Meeting,Planning Zoning & Design Board,2024-05-14,2024,4:31 pm,Estero Village Hall,Accepted,2,Vote,board_vote,infrastructure,"Estero Shadow Wood Community Association - Coconut Road Guardhouse Remodel (LDO2024-E008) (District 6) The guardhouse is located at the entrance to Shadow Wood on Oakwilde Boulevard, north of Coconut Road, and east of Via Coconut Point. Applicant...","Estero Shadow Wood Community Association - Coconut Road Guardhouse Remodel (LDO2024-E008) (District 6) The guardhouse is located at the entrance to Shadow Wood on Oakwilde Boulevard, north of Coconut Road, and east of Via Coconut Point. Applicant...","Estero Shadow Wood Community Association - Coconut Road Guardhouse Remodel (LDO2024-E008) (District 6) The guardhouse is located at the entrance to Shadow Wood on Oakwilde Boulevard, north of Coconut Road, and east of Via Coconut Point. Applicant seeks to. Action: Approved the Limited Development Order with option 1 for the color scheme",LDO2024-E008,land_development_order,,6,,Approved the Limited Development Order with option 1 for the color scheme,Approved the Limited Development Order with option 1 for the color scheme,Approved the Limited Development Order with option 1 for the color scheme,,,See minutes,7,1,,"Coconut Road & Oakwilde Boulevard, Estero, FL","Coconut Road & Oakwilde Boulevard, Estero, FL","Coconut Road & Oakwilde Boulevard, Estero, FL",26.398580002784,-81.798864007834,1.0,item_address,,https://raw.githubusercontent.com/EagleGIS-FGCU/EagleGIS/main/data/raw/pzdb/2024/20240514%20PZDB%20Minutes.pdf,20240514 PZDB Minutes.pdf,pdf_extraction:pzdb,high,false,,true,"Planning Zoning & Design Board meeting on 2024-05-14, agenda item 2 (Vote): Approved the Limited Development Order with option 1 for the color scheme Source: https://raw.githubusercontent.com/EagleGIS-FGCU/EagleGIS/main/data/raw/pzdb/2024/20240514%20PZDB%20Minutes.pdf"
council:1126,council,agenda_item,AgendaItemLocation,231,1126,1010,Village Council,Regular Meeting,Village Council,2024-05-01,2024,9:30 am,Estero Village Hall,Accepted,9,Ordinance,legislative_ordinance,commercial,"Ordinance No. 2024-05 Bella Terra Cell Tower This was deferred from April 17, 2024 An Ordinance of the Village Council of the Village of Estero, Florida, Approving an Amendment to the Commercial Planned Development Zoning in the Bella Terra Develo...","Ordinance No. 2024-05 Bella Terra Cell Tower This was deferred from April 17, 2024 An Ordinance of the Village Council of the Village of Estero, Florida, Approving an Amendment to the Commercial Planned Development Zoning in the Bella Terra Develo...","Ordinance No. 2024-05 Bella Terra Cell Tower This was deferred from April 17, 2024 An Ordinance of the Village Council of the Village of Estero, Florida, Approving an Amendment to the Commercial Planned Development Zoning in the Bella Terra Development to. Action: Approved Ordinance No. 2024-05 with amending condition #4 to state, ""The tower will not contain any lights on the tower including the top, unless lighting is required by any agency with jurisdiction to require lighting, but will be...",Ordinance No. 2024-05,ordinance,Land Development Code,,TD/CS,"Approved Ordinance No. 2024-05 with amending condition #4 to state, ""The tower will not contain any lights on the tower including the top, unless lighting is required by any agency with jurisdiction to require lighting, but will be taped consistent with Land Development Code.""","Approved Ordinance No. 2024-05 with amending condition #4 to state, ""The tower will not contain any lights on the tower including the top, unless lighting is required by any agency with jurisdiction to require lighting, but will be taped consistent with Land Development Code.""","Approved Ordinance No. 2024-05 with amending condition #4 to state, ""The tower will not contain any lights on the tower including the top, unless lighting is required by any agency with jurisdiction to require lighting, but will be taped consistent with Land Development Code.""",,,Detected,,,,"19980 Bella Terra Boulevard, Estero, FL","19980 Bella Terra Boulevard, Estero, FL","19980 Bella Terra Boulevard, Estero, FL",26.450582796918,-81.73115952021,1.0,item_address,,https://estero-fl.gov/wp-content/uploads/library-ada/minutes/2024%20Minutes/05012024%20minutes.pdf,05012024 minutes.pdf,pdf_extraction:council,low,true,Review item 1118: weak or fallback extraction.; Review item 1119: weak or fallback extraction.; Review item 1123: weak or fallback extraction.; Review item 1124: weak or fallback extraction.; Review item 1125: weak or fallback extraction.; Review item 1126: weak or fallback extraction.,false,"Village Council meeting on 2024-05-01, agenda item 9 (Ordinance): Approved Ordinance No. 2024-05 with amending condition #4 to state, ""The tower will not contain any lights on the tower including the top, unless lighting is required by any agency with jurisdiction to require lighting, but will be taped consistent with Land Development Code."" Source: https://estero-fl.gov/wp-content/uploads/library-ada/minutes/2024%20Minutes/05012024%20minutes.pdf"
council:1122,council,agenda_item,AgendaItemLocation,231,1122,1006,Village Council,Regular Meeting,Village Council,2024-05-01,2024,9:30 am,Estero Village Hall,Accepted,5,Resolution,legislative_resolution,open_space,BERT Rail Trail,"Resolution No. 2024-06 Bonita-Estero Rail-Trail (BERT) A Resolution of the Council of the Village of Estero, Florida Expressing Support for Bonita-Estero Rail-Trail Project; Authorizing the","Resolution No. 2024-06 Bonita-Estero Rail-Trail (BERT) A Resolution of the Council of the Village of Estero, Florida Expressing Support for Bonita-Estero Rail-Trail Project; Authorizing the. Action: Approved of the attached Resolution will give credibility to the Village of Estero interest in this acquisition. It can also be used as the necessary financial match for Federal and State grants",Resolution No. 2024-06,resolution,,,TD/CS,Approved of the attached Resolution will give credibility to the Village of Estero interest in this acquisition. It can also be used as the necessary financial match for Federal and State grants,Approved of the attached Resolution will give credibility to the Village of Estero interest in this acquisition. It can also be used as the necessary financial match for Federal and State grants,Approved of the attached Resolution will give credibility to the Village of Estero interest in this acquisition. It can also be used as the necessary financial match for Federal and State grants,,,Detected,,,,"Seminole Gulf Railway corridor from southern Village limits to Estero Parkway, Estero, FL","Seminole Gulf Railway corridor from southern Village limits to Estero Parkway, Estero, FL",BERT Rail Trail Corridor,,,0.9,item_address,,https://estero-fl.gov/wp-content/uploads/library-ada/minutes/2024%20Minutes/05012024%20minutes.pdf,05012024 minutes.pdf,pdf_extraction:council,low,true,Review item 1118: weak or fallback extraction.; Review item 1119: weak or fallback extraction.; Review item 1123: weak or fallback extraction.; Review item 1124: weak or fallback extraction.; Review item 1125: weak or fallback extraction.; Review item 1126: weak or fallback extraction.,false,"Village Council meeting on 2024-05-01, agenda item 5 (Resolution): Approved of the attached Resolution will give credibility to the Village of Estero interest in this acquisition. It can also be used as the necessary financial match for Federal and State grants Source: https://estero-fl.gov/wp-content/uploads/library-ada/minutes/2024%20Minutes/05012024%20minutes.pdf"
council:1121,council,agenda_item,AgendaItemLocation,231,1121,1005,Village Council,Regular Meeting,Village Council,2024-05-01,2024,9:30 am,Estero Village Hall,Accepted,4,Contract Approval,contract_approval,infrastructure,Sandy Lane Improvements,Sandy Lane Bike/Ped Improvements Construction Manager at Risk Contract,"Sandy Lane Bike/Ped Improvements Construction Manager at Risk Contract. Action: Approved Construction Manager at Risk agreement between Village of Estero and Chris-Tel Construction, Inc. for the Sandy Lane Bike/Ped Improvements Project and to authorize the Village Manager to execute the agreement with an effective date of July 1, 2024 and any related documents or amendments as may be necessary, except for the Guaranteed Maximum Price amendment, which will be approved by Council, at a later date",,,,,TD/CS,"Approved Construction Manager at Risk agreement between Village of Estero and Chris-Tel Construction, Inc. for the Sandy Lane Bike/Ped Improvements Project and to authorize the Village Manager to execute the agreement with an effective date of July 1, 2024 and any related documents or amendments as may be necessary, except for the Guaranteed Maximum Price amendment, which will be approved by Council, at a later date","Approved Construction Manager at Risk agreement between Village of Estero and Chris-Tel Construction, Inc. for the Sandy Lane Bike/Ped Improvements Project and to authorize the Village Manager to execute the agreement with an effective date of July 1, 2024 and any related documents or amendments as may be necessary, except for the Guaranteed Maximum Price amendment, which will be approved by Council, at a later date","Approved Construction Manager at Risk agreement between Village of Estero and Chris-Tel Construction, Inc. for the Sandy Lane Bike/Ped Improvements Project and to authorize the Village Manager to execute the agreement with an effective date of July 1, 2024 and any related documents or amendments as may be necessary, except for the Guaranteed Maximum Price amendment, which will be approved by Council, at a later date",,,Detected,,,,"Sandy Lane from Corkscrew Road to Broadway Avenue East, Estero, FL","Sandy Lane from Corkscrew Road to Broadway Avenue East, Estero, FL",Sandy Lane,,,0.9,item_address,,https://estero-fl.gov/wp-content/uploads/library-ada/minutes/2024%20Minutes/05012024%20minutes.pdf,05012024 minutes.pdf,pdf_extraction:council,low,true,Review item 1118: weak or fallback extraction.; Review item 1119: weak or fallback extraction.; Review item 1123: weak or fallback extraction.; Review item 1124: weak or fallback extraction.; Review item 1125: weak or fallback extraction.; Review item 1126: weak or fallback extraction.,false,"Village Council meeting on 2024-05-01, agenda item 4 (Contract Approval): Approved Construction Manager at Risk agreement between Village of Estero and Chris-Tel Construction, Inc. for the Sandy Lane Bike/Ped Improvements Project and to authorize the Village Manager to execute the agreement with an effective date of July 1, 2024 and any related documents or amendments as may be necessary, except for the Guaranteed Maximum Price amendment, which will be approved by Council, at a later date Source: https://estero-fl.gov/wp-content/uploads/library-ada/minutes/2024%20Minutes/05012024%20minutes.pdf"
council:1120,council,agenda_item,AgendaItemLocation,231,1120,1004,Village Council,Regular Meeting,Village Council,2024-05-01,2024,9:30 am,Estero Village Hall,Accepted,3,Contract Approval,contract_approval,infrastructure,Williams Road Improvements,Williams Road and Atlantic Gulf Blvd Intersection Improvements Construction Manager at Risk Contract,"Williams Road and Atlantic Gulf Blvd Intersection Improvements Construction Manager at Risk Contract. Action: Approved Construction Manager at Risk agreement between Village of Estero and Manhattan Construction, Inc. for Williams Road and Atlantic Gulf Blvd Intersection Project and to authorize the Village Manager to execute the agreement and any related documents or amendments as may be necessary, except for the Guaranteed Maximum Price amendment, which will be approved by Council, at a late...",,,,,TD/CS,"Approved Construction Manager at Risk agreement between Village of Estero and Manhattan Construction, Inc. for Williams Road and Atlantic Gulf Blvd Intersection Project and to authorize the Village Manager to execute the agreement and any related documents or amendments as may be necessary, except for the Guaranteed Maximum Price amendment, which will be approved by Council, at a later date","Approved Construction Manager at Risk agreement between Village of Estero and Manhattan Construction, Inc. for Williams Road and Atlantic Gulf Blvd Intersection Project and to authorize the Village Manager to execute the agreement and any related documents or amendments as may be necessary, except for the Guaranteed Maximum Price amendment, which will be approved by Council, at a later date","Approved Construction Manager at Risk agreement between Village of Estero and Manhattan Construction, Inc. for Williams Road and Atlantic Gulf Blvd Intersection Project and to authorize the Village Manager to execute the agreement and any related documents or amendments as may be necessary, except for the Guaranteed Maximum Price amendment, which will be approved by Council, at a later date",,,Detected,,,,"Williams Road & Atlantic Gulf Boulevard, Estero, FL","Williams Road & Atlantic Gulf Boulevard, Estero, FL","Williams Road & Atlantic Gulf Boulevard, Estero, FL",26.420304009887,-81.812656010414,1.0,item_address,,https://estero-fl.gov/wp-content/uploads/library-ada/minutes/2024%20Minutes/05012024%20minutes.pdf,05012024 minutes.pdf,pdf_extraction:council,low,true,Review item 1118: weak or fallback extraction.; Review item 1119: weak or fallback extraction.; Review item 1123: weak or fallback extraction.; Review item 1124: weak or fallback extraction.; Review item 1125: weak or fallback extraction.; Review item 1126: weak or fallback extraction.,false,"Village Council meeting on 2024-05-01, agenda item 3 (Contract Approval): Approved Construction Manager at Risk agreement between Village of Estero and Manhattan Construction, Inc. for Williams Road and Atlantic Gulf Blvd Intersection Project and to authorize the Village Manager to execute the agreement and any related documents or amendments as may be necessary, except for the Guaranteed Maximum Price amendment, which will be approved by Council, at a later date Source: https://estero-fl.gov/wp-content/uploads/library-ada/minutes/2024%20Minutes/05012024%20minutes.pdf"
council:1117,council,agenda_item,AgendaItemLocation,230,1117,1001,Village Council,Regular Meeting,Village Council,2024-04-17,2024,9:30 am,Estero Village Hall,Accepted,5,Vote,board_vote,commercial,"Ordinance No. 2024-05 Bella Terra Cell Tower Applicant has asked for a continuance to May 1, 2024 An Ordinance of the Village Council of the Village of Estero, Florida, Approving an Amendment to the Commercial Planned Development Zoning in the Bel...","Ordinance No. 2024-05 Bella Terra Cell Tower Applicant has asked for a continuance to May 1, 2024 An Ordinance of the Village Council of the Village of Estero, Florida, Approving an Amendment to the Commercial Planned Development Zoning in the Bel...","Ordinance No. 2024-05 Bella Terra Cell Tower Applicant has asked for a continuance to May 1, 2024 An Ordinance of the Village Council of the Village of Estero, Florida, Approving an Amendment to the Commercial Planned Development Zoning in the Bella Terra. Action: Approved continuance to May 1, 20",Ordinance No. 2024-05,ordinance,,,TD/CS,"Approved continuance to May 1, 20","Approved continuance to May 1, 20","Approved continuance to May 1, 20",,,Detected,,,,"19980 Bella Terra Boulevard, Estero, FL","19980 Bella Terra Boulevard, Estero, FL","19980 Bella Terra Boulevard, Estero, FL",26.450582796918,-81.73115952021,1.0,item_address,,https://estero-fl.gov/wp-content/uploads/library-ada/minutes/2024%20Minutes/04172024%20minutes.pdf,04172024 minutes.pdf,pdf_extraction:council,low,true,Review item 1113: weak or fallback extraction.; Review item 1114: weak or fallback extraction.; Review item 1115: weak or fallback extraction.; Review item 1116: weak or fallback extraction.; Review item 1117: weak or fallback extraction.,false,"Village Council meeting on 2024-04-17, agenda item 5 (Vote): Approved continuance to May 1, 20 Source: https://estero-fl.gov/wp-content/uploads/library-ada/minutes/2024%20Minutes/04172024%20minutes.pdf"
