RecordId,SourceBoard,DataGrain,RecordType,MeetingId,ItemId,MotionId,Board,MeetingFormat,MeetingType,MeetingDate,MeetingYear,MeetingTime,MeetingVenue,Status,AgendaItemNumber,AgendaItemType,FactCategory,LandUseCategory,ProjectName,ProjectTitle,Summary,ApplicationId,ApplicationType,ApplicantName,District,StaffCode,ActionTaken,Outcome,MotionText,ProposedBy,SecondedBy,VoteResult,VoteYes,VoteNo,VoteAbstain,AddressRaw,AddressNormalized,LocationName,Latitude,Longitude,GeocodeConfidence,LocationGrain,ParcelId,PrimarySourceUrl,SourceFilename,ExtractionMethod,ExtractionConfidence,ReviewRequired,ReviewReason,AiReady,CitationText
pzdb:46,pzdb,agenda_item,AgendaItemLocation,16,46,28,Planning Zoning & Design Board,Regular Meeting,Planning Zoning & Design Board,2023-06-13,2023,4:33 pm,Estero Village Hall,Accepted,2,Vote,board_vote,mixed_use,Woodfield Estero Planned Development - Rezoning (DCI2022-E005) (District 6) Vacant parcels at the northwest corner of US 41 and Coconut Road. Applicant seeks to rezone ±45.6 acres from Mixed Use Planned Development (MPD) to Estero Planned Developm...,Woodfield Estero Planned Development - Rezoning (DCI2022-E005) (District 6) Vacant parcels at the northwest corner of US 41 and Coconut Road. Applicant seeks to rezone ±45.6 acres from Mixed Use Planned Development (MPD) to Estero Planned Developm...,Woodfield Estero Planned Development - Rezoning (DCI2022-E005) (District 6) Vacant parcels at the northwest corner of US 41 and Coconut Road. Applicant seeks to rezone ±45.6 acres from Mixed Use Planned Development (MPD) to Estero Planned Development (EPD. Action: Approved the motion to continue meeting not to exceed 9:30 pm to resolve this case and all further actions after that would have to continue to the next meeting,DCI2022-E005,development_compliance_inspection,,6,,Approved the motion to continue meeting not to exceed 9:30 pm to resolve this case and all further actions after that would have to continue to the next meeting,Approved the motion to continue meeting not to exceed 9:30 pm to resolve this case and all further actions after that would have to continue to the next meeting,Approved the motion to continue meeting not to exceed 9:30 pm to resolve this case and all further actions after that would have to continue to the next meeting,,,See minutes,4,1,,"Woodfield Estero project site, northwest corner of US 41 & Coconut Road, Estero, FL","Woodfield Estero project site, northwest corner of US 41 & Coconut Road, Estero, FL","Woodfield Estero project site, northwest corner of US 41 & Coconut Road, Estero, FL",26.4022,-81.815,1.0,item_address,,https://raw.githubusercontent.com/EagleGIS-FGCU/EagleGIS/main/data/raw/pzdb/2023/20230613%20PZDB%20Minutes.pdf,20230613 PZDB Minutes.pdf,pdf_extraction:pzdb,high,false,,true,"Planning Zoning & Design Board meeting on 2023-06-13, agenda item 2 (Vote): Approved the motion to continue meeting not to exceed 9:30 pm to resolve this case and all further actions after that would have to continue to the next meeting Source: https://raw.githubusercontent.com/EagleGIS-FGCU/EagleGIS/main/data/raw/pzdb/2023/20230613%20PZDB%20Minutes.pdf"
pzdb:45,pzdb,agenda_item,AgendaItemLocation,16,45,27,Planning Zoning & Design Board,Regular Meeting,Planning Zoning & Design Board,2023-06-13,2023,4:33 pm,Estero Village Hall,Accepted,1,Vote,board_vote,open_space,"RiverCreek Recreation Site - Development Order (DOS2023-E003) (District 7) 12840 Corkscrew Road and 20161 Camellia Crosse Lane Applicant seeks approval of the recreational campus located on Tract ""A"". Recreational amenities include a 14,546 S.F. c...","RiverCreek Recreation Site - Development Order (DOS2023-E003) (District 7) 12840 Corkscrew Road and 20161 Camellia Crosse Lane Applicant seeks approval of the recreational campus located on Tract ""A"". Recreational amenities include a 14,546 S.F. c...","RiverCreek Recreation Site - Development Order (DOS2023-E003) (District 7) 12840 Corkscrew Road and 20161 Camellia Crosse Lane Applicant seeks approval of the recreational campus located on Tract ""A"". Recreational amenities include a 14,546 S.F. clubhouse. Action: Approved the Development Order with the staff conditions",DOS2023-E003,development_order,,7,,Approved the Development Order with the staff conditions,Approved the Development Order with the staff conditions,Approved the Development Order with the staff conditions,,,See minutes,4,1,,12840 Corkscrew Road,"12840 Corkscrew Road, Estero, FL","12840 Corkscrew Road, Estero, FL",26.449146368339,-81.742899851451,1.0,item_address,,https://raw.githubusercontent.com/EagleGIS-FGCU/EagleGIS/main/data/raw/pzdb/2023/20230613%20PZDB%20Minutes.pdf,20230613 PZDB Minutes.pdf,pdf_extraction:pzdb,high,false,,true,"Planning Zoning & Design Board meeting on 2023-06-13, agenda item 1 (Vote): Approved the Development Order with the staff conditions Source: https://raw.githubusercontent.com/EagleGIS-FGCU/EagleGIS/main/data/raw/pzdb/2023/20230613%20PZDB%20Minutes.pdf"
council:980,council,agenda_item,AgendaItemLocation,208,980,869,Village Council,Regular Meeting,Village Council,2023-06-07,2023,9:30 am,Estero Village Hall,Accepted,6,Ordinance,legislative_ordinance,commercial,Williams Road Improvements,"First Reading of Ordinance No. 2023-04, Village Initiated Rezoning on Williams Road An Ordinance of the Village Council of the Village of Estero, Florida, Rezoning 21± Acres of Property Owned by the Village of Estero from Commercial Planned Develo...","First Reading of Ordinance No. 2023-04, Village Initiated Rezoning on Williams Road An Ordinance of the Village Council of the Village of Estero, Florida, Rezoning 21± Acres of Property Owned by the Village of Estero from Commercial Planned Development an. Action: Passed First Reading of Ordinance 2023-04 and set Public Hearing and Second Reading for June 21, 20",Ordinance No. 2023-04,ordinance,,,TD/CS,"Passed First Reading of Ordinance 2023-04 and set Public Hearing and Second Reading for June 21, 20","Passed First Reading of Ordinance 2023-04 and set Public Hearing and Second Reading for June 21, 20","Passed First Reading of Ordinance 2023-04 and set Public Hearing and Second Reading for June 21, 20",,,Detected,,,,"9000 Williams Road, Estero, FL","9000 Williams Road, Estero, FL","9000 Williams Road, Estero, FL",26.420956750596,-81.80311832661,1.0,item_address,,https://estero-fl.gov/wp-content/uploads/library-ada/minutes/2023%20MINUTES/06072023%20%20minutes.pdf,06072023 minutes.pdf,pdf_extraction:council,low,true,Review item 975: weak or fallback extraction.; Review item 976: weak or fallback extraction.; Review item 977: weak or fallback extraction.; Review item 978: weak or fallback extraction.; Review item 979: weak or fallback extraction.; Review item 981: weak or fallback extraction.; Review item 1366: weak or fallback extraction.; Review item 1367: weak or fallback extraction.; Review item 1368: weak or fallback extraction.; Review item 1369: weak or fallback extraction.; Review item 1370: weak or fallback extraction.; Review item 1371: weak or fallback extraction.; Review item 1372: weak or fallback extraction.,false,"Village Council meeting on 2023-06-07, agenda item 6 (Ordinance): Passed First Reading of Ordinance 2023-04 and set Public Hearing and Second Reading for June 21, 20 Source: https://estero-fl.gov/wp-content/uploads/library-ada/minutes/2023%20MINUTES/06072023%20%20minutes.pdf"
council:973,council,agenda_item,AgendaItemLocation,207,973,862,Village Council,Regular Meeting,Village Council,2023-05-17,2023,9:30 am,Estero Village Hall,Accepted,3,Contract Approval,contract_approval,infrastructure,Corkscrew Road,Corkscrew Road Wetland Mitigation Credits,"Corkscrew Road Wetland Mitigation Credits. Action: Approved the Agreement for Sale of Mitigation Bank Credits with Corkscrew Mitigation, LLC for 0.83 credits at a cost of $157,700, and authorize the Village Manager to sign the agreement and other additional implementing documents within the scope of the agreement on behalf of the Village of Estero Council",,,Corkscrew Mitigation,,TD/CS,"Approved the Agreement for Sale of Mitigation Bank Credits with Corkscrew Mitigation, LLC for 0.83 credits at a cost of $157,700, and authorize the Village Manager to sign the agreement and other additional implementing documents within the scope of the agreement on behalf of the Village of Estero Council","Approved the Agreement for Sale of Mitigation Bank Credits with Corkscrew Mitigation, LLC for 0.83 credits at a cost of $157,700, and authorize the Village Manager to sign the agreement and other additional implementing documents within the scope of the agreement on behalf of the Village of Estero Council","Approved the Agreement for Sale of Mitigation Bank Credits with Corkscrew Mitigation, LLC for 0.83 credits at a cost of $157,700, and authorize the Village Manager to sign the agreement and other additional implementing documents within the scope of the agreement on behalf of the Village of Estero Council",,,Detected,,,,"Corkscrew Road from Ben Hill Griffin Parkway to east of Bella Terra Boulevard, Estero, FL","Corkscrew Road from Ben Hill Griffin Parkway to east of Bella Terra Boulevard, Estero, FL",Corkscrew Road Widening Corridor,,,0.9,item_address,,https://estero-fl.gov/wp-content/uploads/library-ada/minutes/2023%20MINUTES/05172023%20%20minutes.pdf,05172023 minutes.pdf,pdf_extraction:council,low,true,Review item 971: weak or fallback extraction.; Review item 972: weak or fallback extraction.; Review item 974: weak or fallback extraction.; Review item 1362: weak or fallback extraction.; Review item 1363: weak or fallback extraction.; Review item 1364: weak or fallback extraction.; Review item 1365: weak or fallback extraction.,false,"Village Council meeting on 2023-05-17, agenda item 3 (Contract Approval): Approved the Agreement for Sale of Mitigation Bank Credits with Corkscrew Mitigation, LLC for 0.83 credits at a cost of $157,700, and authorize the Village Manager to sign the agreement and other additional implementing documents within the scope of the agreement on behalf of the Village of Estero Council Source: https://estero-fl.gov/wp-content/uploads/library-ada/minutes/2023%20MINUTES/05172023%20%20minutes.pdf"
pzdb:43,pzdb,agenda_item,AgendaItemLocation,15,43,26,Planning Zoning & Design Board,Regular Meeting,Planning Zoning & Design Board,2023-05-09,2023,4:38 pm,Estero Village Hall,Accepted,2,Vote,board_vote,open_space,The Brooks Commons Club - Pickleball Court Expansion Limited Development Order (LDO2022-E051) (District 6) Applicant is seeking approval for the redevelopment of a portion of the community's property on Coconut Road adjacent to the Commons Club. T...,The Brooks Commons Club - Pickleball Court Expansion Limited Development Order (LDO2022-E051) (District 6) Applicant is seeking approval for the redevelopment of a portion of the community's property on Coconut Road adjacent to the Commons Club. T...,"The Brooks Commons Club - Pickleball Court Expansion Limited Development Order (LDO2022-E051) (District 6) Applicant is seeking approval for the redevelopment of a portion of the community's property on Coconut Road adjacent to the Commons Club. The park'. Action: Approved the Development with the following conditions: to delegate where the bicycle spaces will be in proximity to the courts, they have three months to remediate any sound violations, the sound violations will be set off Ansi sta...",LDO2022-E051,land_development_order,,6,,"Approved the Development with the following conditions: to delegate where the bicycle spaces will be in proximity to the courts, they have three months to remediate any sound violations, the sound violations will be set off Ansi standards of 55 decibels, and staff will work with the applicant to meet the lighting requirements","Approved the Development with the following conditions: to delegate where the bicycle spaces will be in proximity to the courts, they have three months to remediate any sound violations, the sound violations will be set off Ansi standards of 55 decibels, and staff will work with the applicant to meet the lighting requirements","Approved the Development with the following conditions: to delegate where the bicycle spaces will be in proximity to the courts, they have three months to remediate any sound violations, the sound violations will be set off Ansi standards of 55 decibels, and staff will work with the applicant to meet the lighting requirements",,,See minutes,5,1,0,"Commons Club at The Brooks, Estero, FL","Commons Club at The Brooks, Estero, FL","Commons Club at The Brooks, Estero, FL",26.3974648,-81.7889557,1.0,item_address,,https://raw.githubusercontent.com/EagleGIS-FGCU/EagleGIS/main/data/raw/pzdb/2023/20230509%20PZDB%20Minutes.pdf,20230509 PZDB Minutes.pdf,pdf_extraction:pzdb,high,false,,true,"Planning Zoning & Design Board meeting on 2023-05-09, agenda item 2 (Vote): Approved the Development with the following conditions: to delegate where the bicycle spaces will be in proximity to the courts, they have three months to remediate any sound violations, the sound violations will be set off Ansi standards of 55 decibels, and staff will work with the applicant to meet the lighting requirements Source: https://raw.githubusercontent.com/EagleGIS-FGCU/EagleGIS/main/data/raw/pzdb/2023/20230509%20PZDB%20Minutes.pdf"
pzdb:42,pzdb,agenda_item,AgendaItemLocation,15,42,25,Planning Zoning & Design Board,Regular Meeting,Planning Zoning & Design Board,2023-05-09,2023,4:38 pm,Estero Village Hall,Accepted,1,Vote,board_vote,open_space,"Corkscrew Pines Self-Storage - Development Order (DOS2022-E008) (District 5) Located on the south side of Corkscrew Road, east of Stoneybrook Golf Drive and west of Firehouse Lane. Applicant is proposing to construct 3 storage buildings totaling ±...","Corkscrew Pines Self-Storage - Development Order (DOS2022-E008) (District 5) Located on the south side of Corkscrew Road, east of Stoneybrook Golf Drive and west of Firehouse Lane. Applicant is proposing to construct 3 storage buildings totaling ±...","Corkscrew Pines Self-Storage - Development Order (DOS2022-E008) (District 5) Located on the south side of Corkscrew Road, east of Stoneybrook Golf Drive and west of Firehouse Lane. Applicant is proposing to construct 3 storage buildings totaling ±150,000 . Action: Approved the Development with the conditions as follows: columns 7, 8, 13, and 14 has an 8-inch projection forward, There will be a minimum 4-foot additional depth in the center of the building columns 8 through 11, the landscape bu...",DOS2022-E008,development_order,,5,,"Approved the Development with the conditions as follows: columns 7, 8, 13, and 14 has an 8-inch projection forward, There will be a minimum 4-foot additional depth in the center of the building columns 8 through 11, the landscape buffer will be clustered and add depth and break up the linear run of the landscape buffer in general, the tower height is going to have a vertical differential minimum of two feet from the parapet of the building, the plants around the lift station and the garbage dumpster are going to be increased to a 48-inch minimum size, the cluster of trees at the west end of the building will go to a 14 to 16-foot minimum, and the west side of the building was going to have red maples instead of cypress, and we were going to add foundation plantings along the east, west, and north side of building one","Approved the Development with the conditions as follows: columns 7, 8, 13, and 14 has an 8-inch projection forward, There will be a minimum 4-foot additional depth in the center of the building columns 8 through 11, the landscape buffer will be clustered and add depth and break up the linear run of the landscape buffer in general, the tower height is going to have a vertical differential minimum of two feet from the parapet of the building, the plants around the lift station and the garbage dumpster are going to be increased to a 48-inch minimum size, the cluster of trees at the west end of the building will go to a 14 to 16-foot minimum, and the west side of the building was going to have red maples instead of cypress, and we were going to add foundation plantings along the east, west, and north side of building one","Approved the Development with the conditions as follows: columns 7, 8, 13, and 14 has an 8-inch projection forward, There will be a minimum 4-foot additional depth in the center of the building columns 8 through 11, the landscape buffer will be clustered and add depth and break up the linear run of the landscape buffer in general, the tower height is going to have a vertical differential minimum of two feet from the parapet of the building, the plants around the lift station and the garbage dumpster are going to be increased to a 48-inch minimum size, the cluster of trees at the west end of the building will go to a 14 to 16-foot minimum, and the west side of the building was going to have red maples instead of cypress, and we were going to add foundation plantings along the east, west, and north side of building one",,,See minutes,6,1,,"Corkscrew Pines project site, Estero, FL","Corkscrew Pines project site, Estero, FL","Corkscrew Pines project site, Estero, FL",26.4383,-81.7603,1.0,item_address,,https://raw.githubusercontent.com/EagleGIS-FGCU/EagleGIS/main/data/raw/pzdb/2023/20230509%20PZDB%20Minutes.pdf,20230509 PZDB Minutes.pdf,pdf_extraction:pzdb,high,false,,true,"Planning Zoning & Design Board meeting on 2023-05-09, agenda item 1 (Vote): Approved the Development with the conditions as follows: columns 7, 8, 13, and 14 has an 8-inch projection forward, There will be a minimum 4-foot additional depth in the center of the building columns 8 through 11, the landscape buffer will be clustered and add depth and break up the linear run of the landscape buffer in general, the tower height is going to have a vertical differential minimum of two feet from the parapet of the building, the plants around the lift station and the garbage dumpster are going to be increased to a 48-inch minimum size, the cluster of trees at the west end of the building will go to a 14 to 16-foot minimum, and the west side of the building was going to have red maples instead of cypress, and we were going to add foundation plantings along the east, west, and north side of building one Source: https://raw.githubusercontent.com/EagleGIS-FGCU/EagleGIS/main/data/raw/pzdb/2023/20230509%20PZDB%20Minutes.pdf"
council:1360,council,agenda_item,AgendaItemLocation,271,1360,1234,Village Council,Regular Meeting,Village Council,2023-05-03,2023,9:30 am,Estero Village Hall,Accepted,5,Contract Approval,contract_approval,infrastructure,Williams Road Improvements,Approved the consultants ranking for Williams Road Widening Preliminary Design and Enginee,"Approved the consultants ranking for Williams Road Widening Preliminary Design and Engineering Project as follows: Number 1 - Kisinger Campo & Associates; Number 2 - Q. Grady Minor & Associates; Number 3 - Kimley-Horn and Associates, authorize staff to negotiate a contract with the Number 1 ranked firm, Kisinger Campo & Associates, to provide professional consulting services for the Williams Road Widening Preliminary Design and Engineering Project",,,,,ON/KE,"Approved the consultants ranking for Williams Road Widening Preliminary Design and Engineering Project as follows: Number 1 - Kisinger Campo & Associates; Number 2 - Q. Grady Minor & Associates; Number 3 - Kimley-Horn and Associates, authorize staff to negotiate a contract with the Number 1 ranked firm, Kisinger Campo & Associates, to provide professional consulting services for the Williams Road Widening Preliminary Design and Engineering Project","Approved the consultants ranking for Williams Road Widening Preliminary Design and Engineering Project as follows: Number 1 - Kisinger Campo & Associates; Number 2 - Q. Grady Minor & Associates; Number 3 - Kimley-Horn and Associates, authorize staff to negotiate a contract with the Number 1 ranked firm, Kisinger Campo & Associates, to provide professional consulting services for the Williams Road Widening Preliminary Design and Engineering Project","Approved the consultants ranking for Williams Road Widening Preliminary Design and Engineering Project as follows: Number 1 - Kisinger Campo & Associates; Number 2 - Q. Grady Minor & Associates; Number 3 - Kimley-Horn and Associates, authorize staff to negotiate a contract with the Number 1 ranked firm, Kisinger Campo & Associates, to provide professional consulting services for the Williams Road Widening Preliminary Design and Engineering Project",,,Detected,,,,"Williams Road from US 41 to Via Coconut Point, Estero, FL","Williams Road from US 41 to Via Coconut Point, Estero, FL","Williams Road from US 41 to Via Coconut Point, Estero, FL",26.420397237605,-81.80904475125,0.95,item_address,,https://estero-fl.gov/wp-content/uploads/library-ada/minutes/2023%20MINUTES/04192023%20%20minutes.pdf,04192023 minutes.pdf,pdf_extraction:council,low,true,Review item 959: weak or fallback extraction.; Review item 960: weak or fallback extraction.; Review item 961: weak or fallback extraction.; Review item 964: weak or fallback extraction.; Review item 1356: weak or fallback extraction.; Review item 1357: weak or fallback extraction.; Review item 1358: weak or fallback extraction.; Review item 1359: weak or fallback extraction.; Review item 1360: weak or fallback extraction.; Review item 1361: weak or fallback extraction.,false,"Village Council meeting on 2023-05-03, agenda item 5 (Contract Approval): Approved the consultants ranking for Williams Road Widening Preliminary Design and Engineering Project as follows: Number 1 - Kisinger Campo & Associates; Number 2 - Q. Grady Minor & Associates; Number 3 - Kimley-Horn and Associates, authorize staff to negotiate a contract with the Number 1 ranked firm, Kisinger Campo & Associates, to provide professional consulting services for the Williams Road Widening Preliminary Design and Engineering Project Source: https://estero-fl.gov/wp-content/uploads/library-ada/minutes/2023%20MINUTES/04192023%20%20minutes.pdf"
