RecordId,SourceBoard,DataGrain,RecordType,MeetingId,ItemId,MotionId,Board,MeetingFormat,MeetingType,MeetingDate,MeetingYear,MeetingTime,MeetingVenue,Status,AgendaItemNumber,AgendaItemType,FactCategory,LandUseCategory,ProjectName,ProjectTitle,Summary,ApplicationId,ApplicationType,ApplicantName,District,StaffCode,ActionTaken,Outcome,MotionText,ProposedBy,SecondedBy,VoteResult,VoteYes,VoteNo,VoteAbstain,AddressRaw,AddressNormalized,LocationName,Latitude,Longitude,GeocodeConfidence,LocationGrain,ParcelId,PrimarySourceUrl,SourceFilename,ExtractionMethod,ExtractionConfidence,ReviewRequired,ReviewReason,AiReady,CitationText
council:668,council,agenda_item,AgendaItemLocation,159,668,569,Village Council,Regular Meeting,Village Council,2021-04-07,2021,9:30 am,Estero Village Hall,Accepted,3,Resolution,legislative_resolution,infrastructure,Corkscrew Road,"Resolution No. 2021-10 of the Village Council of the Village of Estero, Florida, Approving the Second Budget Amendment for Fiscal Year 2020-2021 to Approve Use of Additional Village Funds and Provide a Funding Transfer for Corkscrew Road/Puente La...","Resolution No. 2021-10 of the Village Council of the Village of Estero, Florida, Approving the Second Budget Amendment for Fiscal Year 2020-2021 to Approve Use of Additional Village Funds and Provide a Funding Transfer for Corkscrew Road/Puente Lane Traff. Action: Approved Resolution 2021",Resolution No. 2021-10,resolution,,,TD/CS,Approved Resolution 2021,Approved Resolution 2021,Approved Resolution 2021,,,Detected,,,,"Corkscrew Road & Puente Lane, Estero, FL","Corkscrew Road & Puente Lane, Estero, FL","Corkscrew Road & Puente Lane, Estero, FL",26.431386394627,-81.784740920078,1.0,item_address,,https://estero-fl.gov/wp-content/uploads/library-ada/minutes/2021%20Minutes/COUNCIL/04072021%20minutes.pdf,04072021 minutes.pdf,pdf_extraction:council,low,true,Review item 666: weak or fallback extraction.; Review item 667: weak or fallback extraction.; Review item 669: weak or fallback extraction.; Review item 672: weak or fallback extraction.; Review item 673: weak or fallback extraction.,false,"Village Council meeting on 2021-04-07, agenda item 3 (Resolution): Approved Resolution 2021 Source: https://estero-fl.gov/wp-content/uploads/library-ada/minutes/2021%20Minutes/COUNCIL/04072021%20minutes.pdf"
council:655,council,agenda_item,AgendaItemLocation,156,655,559,Village Council,Regular Meeting,Village Council,2021-03-03,2021,9:30 am,Estero Village Hall,Accepted,5,Contract Approval,contract_approval,infrastructure,Estero River North Branch Drainage Improvements Contract,Estero River North Branch Drainage Improvements Contract,Estero River North Branch Drainage Improvements Contract. Action: Approved Estero River North Branch Drainage Improvements contract with JR Evans Engineering under Supplemental Task Authorization (STA) - 03 Contract EC 2020-30 Miscellaneous Professional Services to perform a suite of design services for drainage improvements along the North Branch of the Estero River from Bamboo Island to River Oaks Preserve. Approve a 10% contingency for additional services that may be required to complete t...,EC 2020-30,engineering_certificate,,,TD/CS,Approved Estero River North Branch Drainage Improvements contract with JR Evans Engineering under Supplemental Task Authorization (STA) - 03 Contract EC 2020-30 Miscellaneous Professional Services to perform a suite of design services for drainage improvements along the North Branch of the Estero River from Bamboo Island to River Oaks Preserve. Approve a 10% contingency for additional services that may be required to complete the project. Authorize the Village Manager to sign the STA and other additional implementing documents within the scope of the STA on behalf of the Village ofEstero Council,Approved Estero River North Branch Drainage Improvements contract with JR Evans Engineering under Supplemental Task Authorization (STA) - 03 Contract EC 2020-30 Miscellaneous Professional Services to perform a suite of design services for drainage improvements along the North Branch of the Estero River from Bamboo Island to River Oaks Preserve. Approve a 10% contingency for additional services that may be required to complete the project. Authorize the Village Manager to sign the STA and other additional implementing documents within the scope of the STA on behalf of the Village ofEstero Council,Approved Estero River North Branch Drainage Improvements contract with JR Evans Engineering under Supplemental Task Authorization (STA) - 03 Contract EC 2020-30 Miscellaneous Professional Services to perform a suite of design services for drainage improvements along the North Branch of the Estero River from Bamboo Island to River Oaks Preserve. Approve a 10% contingency for additional services that may be required to complete the project. Authorize the Village Manager to sign the STA and other additional implementing documents within the scope of the STA on behalf of the Village ofEstero Council,,,Detected,,,,"Estero River North Branch from Bamboo Island to River Oaks Preserve, Estero, FL","Estero River North Branch from Bamboo Island to River Oaks Preserve, Estero, FL","Estero River North Branch from Bamboo Island to River Oaks Preserve, Estero, FL",,,0.9,item_address,,https://estero-fl.gov/wp-content/uploads/library-ada/minutes/2021%20Minutes/COUNCIL/03032021%20minutes.pdf,03032021 minutes.pdf,pdf_extraction:council,low,true,Review item 651: weak or fallback extraction.; Review item 652: weak or fallback extraction.; Review item 653: weak or fallback extraction.; Review item 654: weak or fallback extraction.; Review item 655: weak or fallback extraction.; Review item 656: weak or fallback extraction.,false,"Village Council meeting on 2021-03-03, agenda item 5 (Contract Approval): Approved Estero River North Branch Drainage Improvements contract with JR Evans Engineering under Supplemental Task Authorization (STA) - 03 Contract EC 2020-30 Miscellaneous Professional Services to perform a suite of design services for drainage improvements along the North Branch of the Estero River from Bamboo Island to River Oaks Preserve. Approve a 10% contingency for additional services that may be required to complete the project. Authorize the Village Manager to sign the STA and other additional implementing documents within the scope of the STA on behalf of the Village ofEstero Council Source: https://estero-fl.gov/wp-content/uploads/library-ada/minutes/2021%20Minutes/COUNCIL/03032021%20minutes.pdf"
council:650,council,agenda_item,AgendaItemLocation,155,650,557,Village Council,Regular Meeting,Village Council,2021-03-03,2021,9:30 am,Estero Fire Rescue,Accepted,6,Contract Approval,contract_approval,infrastructure,Ben Hill Griffin Parkway Improvements,Ben Hill Griffin Landscape Design,"Ben Hill Griffin Landscape Design. Action: Approved Ben Hill Griffin Parkway Preliminary Landscape Design contracts with Bruce Howard and Associates under EC2020-42 and RWA Engineering under EC2020-67 to perform a suite of design services for the proposed landscape improvements along Ben Hill Griffin Parkway from Corkscrew Road to Estero Parkway, approve a 10% contingency for additional services that may be required to complete the project, and Authorize the Village Manager to sign the Supple...",,,Bruce Howard and Associates under EC2020-42 and RWA Engineering under EC2020-67,,TD/CS,"Approved Ben Hill Griffin Parkway Preliminary Landscape Design contracts with Bruce Howard and Associates under EC2020-42 and RWA Engineering under EC2020-67 to perform a suite of design services for the proposed landscape improvements along Ben Hill Griffin Parkway from Corkscrew Road to Estero Parkway, approve a 10% contingency for additional services that may be required to complete the project, and Authorize the Village Manager to sign the Supplemental Task Authorization (ST","Approved Ben Hill Griffin Parkway Preliminary Landscape Design contracts with Bruce Howard and Associates under EC2020-42 and RWA Engineering under EC2020-67 to perform a suite of design services for the proposed landscape improvements along Ben Hill Griffin Parkway from Corkscrew Road to Estero Parkway, approve a 10% contingency for additional services that may be required to complete the project, and Authorize the Village Manager to sign the Supplemental Task Authorization (ST","Approved Ben Hill Griffin Parkway Preliminary Landscape Design contracts with Bruce Howard and Associates under EC2020-42 and RWA Engineering under EC2020-67 to perform a suite of design services for the proposed landscape improvements along Ben Hill Griffin Parkway from Corkscrew Road to Estero Parkway, approve a 10% contingency for additional services that may be required to complete the project, and Authorize the Village Manager to sign the Supplemental Task Authorization (ST",,,Detected,,,,"Ben Hill Griffin Parkway from Corkscrew Road to Estero Parkway, Estero, FL","Ben Hill Griffin Parkway from Corkscrew Road to Estero Parkway, Estero, FL","Ben Hill Griffin Parkway from Corkscrew Road to Estero Parkway, Estero, FL",26.442888042165,-81.772410260408,0.95,item_address,,https://estero-fl.gov/wp-content/uploads/library-ada/minutes/2021%20Minutes/COUNCIL/0232021%20minutes.pdf,0232021 minutes.pdf,pdf_extraction:council,low,true,Review item 645: weak or fallback extraction.; Review item 646: weak or fallback extraction.; Review item 647: weak or fallback extraction.; Review item 648: weak or fallback extraction.,false,"Village Council meeting on 2021-03-03, agenda item 6 (Contract Approval): Approved Ben Hill Griffin Parkway Preliminary Landscape Design contracts with Bruce Howard and Associates under EC2020-42 and RWA Engineering under EC2020-67 to perform a suite of design services for the proposed landscape improvements along Ben Hill Griffin Parkway from Corkscrew Road to Estero Parkway, approve a 10% contingency for additional services that may be required to complete the project, and Authorize the Village Manager to sign the Supplemental Task Authorization (ST Source: https://estero-fl.gov/wp-content/uploads/library-ada/minutes/2021%20Minutes/COUNCIL/0232021%20minutes.pdf"
council:649,council,agenda_item,AgendaItemLocation,155,649,556,Village Council,Regular Meeting,Village Council,2021-03-03,2021,9:30 am,Estero Fire Rescue,Accepted,5,Contract Approval,contract_approval,infrastructure,Williams Road Improvements,Williams Road Bicycle & Pedestrian Improvements - Concept Design Contract,"Williams Road Bicycle & Pedestrian Improvements - Concept Design Contract. Action: Approved the Williams Road Bicycle and Pedestrian Improvements - Concept Design contract with Banks Engineering under Supplemental Task Authorization (STA) - 01 Contract EC 2020-56 Miscellaneous Professional Services to perform a suite of design services for the Bicycle & Pedestrian improvements along Williams Road, between US 41 and Three Oaks Parkway, approve a 10% contingency for additional services that may...",EC 2020-56,engineering_certificate,,,TD/CS,"Approved the Williams Road Bicycle and Pedestrian Improvements - Concept Design contract with Banks Engineering under Supplemental Task Authorization (STA) - 01 Contract EC 2020-56 Miscellaneous Professional Services to perform a suite of design services for the Bicycle & Pedestrian improvements along Williams Road, between US 41 and Three Oaks Parkway, approve a 10% contingency for additional services that may be required to complete the project, and authorize the Village Manger to sign the STA and other additional implementing documents within the scope of the STA on behalf of the Village of Estero Council","Approved the Williams Road Bicycle and Pedestrian Improvements - Concept Design contract with Banks Engineering under Supplemental Task Authorization (STA) - 01 Contract EC 2020-56 Miscellaneous Professional Services to perform a suite of design services for the Bicycle & Pedestrian improvements along Williams Road, between US 41 and Three Oaks Parkway, approve a 10% contingency for additional services that may be required to complete the project, and authorize the Village Manger to sign the STA and other additional implementing documents within the scope of the STA on behalf of the Village of Estero Council","Approved the Williams Road Bicycle and Pedestrian Improvements - Concept Design contract with Banks Engineering under Supplemental Task Authorization (STA) - 01 Contract EC 2020-56 Miscellaneous Professional Services to perform a suite of design services for the Bicycle & Pedestrian improvements along Williams Road, between US 41 and Three Oaks Parkway, approve a 10% contingency for additional services that may be required to complete the project, and authorize the Village Manger to sign the STA and other additional implementing documents within the scope of the STA on behalf of the Village of Estero Council",,,Detected,,,,"Williams Road from Via Coconut Point to Three Oaks Parkway, Estero, FL","Williams Road from Via Coconut Point to Three Oaks Parkway, Estero, FL","Williams Road from Via Coconut Point to Three Oaks Parkway, Estero, FL",26.420434746622,-81.797464230004,0.95,item_address,,https://estero-fl.gov/wp-content/uploads/library-ada/minutes/2021%20Minutes/COUNCIL/0232021%20minutes.pdf,0232021 minutes.pdf,pdf_extraction:council,low,true,Review item 645: weak or fallback extraction.; Review item 646: weak or fallback extraction.; Review item 647: weak or fallback extraction.; Review item 648: weak or fallback extraction.,false,"Village Council meeting on 2021-03-03, agenda item 5 (Contract Approval): Approved the Williams Road Bicycle and Pedestrian Improvements - Concept Design contract with Banks Engineering under Supplemental Task Authorization (STA) - 01 Contract EC 2020-56 Miscellaneous Professional Services to perform a suite of design services for the Bicycle & Pedestrian improvements along Williams Road, between US 41 and Three Oaks Parkway, approve a 10% contingency for additional services that may be required to complete the project, and authorize the Village Manger to sign the STA and other additional implementing documents within the scope of the STA on behalf of the Village of Estero Council Source: https://estero-fl.gov/wp-content/uploads/library-ada/minutes/2021%20Minutes/COUNCIL/0232021%20minutes.pdf"
council:627,council,agenda_item,AgendaItemLocation,151,627,536,Village Council,Regular Meeting,Village Council,2021-01-20,2021,9:30 am,Estero Village Hall,Accepted,5,Ordinance,legislative_ordinance,infrastructure,Corkscrew Road,Motion to approve Estero Crossing - Corkscrew Road/Puente Lane Traffic Signal Agreement wi,Motion to approve Estero Crossing - Corkscrew Road/Puente Lane Traffic Signal Agreement with the revision to remove the last sentence of paragraph 5 to be consistent with Ordinance 2020,,,,,TD/CS,Motion to approve Estero Crossing - Corkscrew Road/Puente Lane Traffic Signal Agreement with the revision to remove the last sentence of paragraph 5 to be consistent with Ordinance 2020,Motion to approve Estero Crossing - Corkscrew Road/Puente Lane Traffic Signal Agreement with the revision to remove the last sentence of paragraph 5 to be consistent with Ordinance 2020,Motion to approve Estero Crossing - Corkscrew Road/Puente Lane Traffic Signal Agreement with the revision to remove the last sentence of paragraph 5 to be consistent with Ordinance 2020,,,Detected,,,,"Corkscrew Road & Puente Lane, Estero, FL","Corkscrew Road & Puente Lane, Estero, FL","Corkscrew Road & Puente Lane, Estero, FL",26.431386394627,-81.784740920078,1.0,item_address,,https://estero-fl.gov/wp-content/uploads/library-ada/minutes/2021%20Minutes/COUNCIL/01202021%20minutes.pdf,01202021 minutes.pdf,pdf_extraction:council,low,true,Review item 623: weak or fallback extraction.; Review item 624: weak or fallback extraction.; Review item 625: weak or fallback extraction.; Review item 626: weak or fallback extraction.; Review item 628: weak or fallback extraction.,false,"Village Council meeting on 2021-01-20, agenda item 5 (Ordinance): Motion to approve Estero Crossing - Corkscrew Road/Puente Lane Traffic Signal Agreement with the revision to remove the last sentence of paragraph 5 to be consistent with Ordinance 2020 Source: https://estero-fl.gov/wp-content/uploads/library-ada/minutes/2021%20Minutes/COUNCIL/01202021%20minutes.pdf"
council:640,council,agenda_item,AgendaItemLocation,153,640,548,Village Council,Regular Meeting,Village Council,2021-01-06,2021,9:30 am,Legacy Church,Accepted,8,Ordinance,legislative_ordinance,infrastructure,Comprehensive Plan,"Second Public Hearing to consider Ordinance 2020-07 to adopt a Comprehensive Plan Amendment for annexed property located at 4528 and 4408-4410 Coconut Road. An Ordinance of the Village Council of the Village of Estero, Florida, Adopting an Amendme...","Second Public Hearing to consider Ordinance 2020-07 to adopt a Comprehensive Plan Amendment for annexed property located at 4528 and 4408-4410 Coconut Road. An Ordinance of the Village Council of the Village of Estero, Florida, Adopting an Amendment to th. Action: Adopted Ordinance 2020",Ordinance 2020-07,ordinance,,,TD/SS,Adopted Ordinance 2020,Adopted Ordinance 2020,Adopted Ordinance 2020,,,Detected,,,,4410 Coconut Road,"4410 Coconut Road, Estero, FL",4410 Coconut Road,26.398566005006,-81.82671497661,1.0,item_address,,https://estero-fl.gov/wp-content/uploads/library-ada/minutes/2021%20Minutes/COUNCIL/0162021%20Minutes.pdf,0162021 Minutes.pdf,pdf_extraction:council,low,true,Review item 633: weak or fallback extraction.; Review item 634: weak or fallback extraction.; Review item 635: weak or fallback extraction.; Review item 636: weak or fallback extraction.; Review item 638: weak or fallback extraction.; Review item 639: weak or fallback extraction.,false,"Village Council meeting on 2021-01-06, agenda item 8 (Ordinance): Adopted Ordinance 2020 Source: https://estero-fl.gov/wp-content/uploads/library-ada/minutes/2021%20Minutes/COUNCIL/0162021%20Minutes.pdf"
council:637,council,agenda_item,AgendaItemLocation,153,637,545,Village Council,Regular Meeting,Village Council,2021-01-06,2021,9:30 am,Legacy Church,Accepted,5,Ordinance,legislative_ordinance,infrastructure,Corkscrew Road,"First Reading of Ordinance 2020-11 for Estero Crossing relating to the traffic signal at Corkscrew Road and Puente Lane An Ordinance of the Village Council of the Village of Estero, Florida, Amending Ordinance 2019-29 to Revise Certain Transportat...","First Reading of Ordinance 2020-11 for Estero Crossing relating to the traffic signal at Corkscrew Road and Puente Lane An Ordinance of the Village Council of the Village of Estero, Florida, Amending Ordinance 2019-29 to Revise Certain Transportation Cond. Action: Passed first reading of Ordinance No. 2020-11 and schedule second reading/public hearing for January 20, 20",Ordinance 2020-11,ordinance,,,TD/SS,"Passed first reading of Ordinance No. 2020-11 and schedule second reading/public hearing for January 20, 20","Passed first reading of Ordinance No. 2020-11 and schedule second reading/public hearing for January 20, 20","Passed first reading of Ordinance No. 2020-11 and schedule second reading/public hearing for January 20, 20",,,Detected,,,,"Corkscrew Road from Ben Hill Griffin Parkway to east of Bella Terra Boulevard, Estero, FL","Corkscrew Road at Puente Lane, Estero, FL",Corkscrew Rd / Puente Lane,26.431386394627,-81.784740920078,1.0,item_address,,https://estero-fl.gov/wp-content/uploads/library-ada/minutes/2021%20Minutes/COUNCIL/0162021%20Minutes.pdf,0162021 Minutes.pdf,pdf_extraction:council,low,true,Review item 633: weak or fallback extraction.; Review item 634: weak or fallback extraction.; Review item 635: weak or fallback extraction.; Review item 636: weak or fallback extraction.; Review item 638: weak or fallback extraction.; Review item 639: weak or fallback extraction.,false,"Village Council meeting on 2021-01-06, agenda item 5 (Ordinance): Passed first reading of Ordinance No. 2020-11 and schedule second reading/public hearing for January 20, 20 Source: https://estero-fl.gov/wp-content/uploads/library-ada/minutes/2021%20Minutes/COUNCIL/0162021%20Minutes.pdf"
council:552,council,agenda_item,AgendaItemLocation,136,552,469,Village Council,Regular Meeting,Village Council,2020-11-04,2020,9:30 pm,Estero Fire Rescue,Accepted,3,Resolution,legislative_resolution,infrastructure,Corkscrew Road,"Resolution 2020-23 of the Village Council of the Village of Estero, Florida, approving a Budget Amendment for Fiscal Year 2020-2021 to include the Corkscrew Road - Puente Lane Traffic Signal; and providing an effective date","Resolution 2020-23 of the Village Council of the Village of Estero, Florida, approving a Budget Amendment for Fiscal Year 2020-2021 to include the Corkscrew Road - Puente Lane Traffic Signal; and providing an effective date. Action: Adopted Resolution 2020",Resolution 2020-23,resolution,,,TD/SS,Adopted Resolution 2020,Adopted Resolution 2020,Adopted Resolution 2020,,,Detected,,,,"Corkscrew Road & Puente Lane, Estero, FL","Corkscrew Road & Puente Lane, Estero, FL","Corkscrew Road & Puente Lane, Estero, FL",26.431386394627,-81.784740920078,1.0,item_address,,https://estero-fl.gov/wp-content/uploads/library-ada/minutes/2020%20Minutes/Council/11042020%20Council%20Meeting%20Minutes.pdf,11042020 Council Meeting Minutes.pdf,pdf_extraction:council,low,true,Review item 550: weak or fallback extraction.; Review item 551: weak or fallback extraction.; Review item 553: weak or fallback extraction.; Review item 554: weak or fallback extraction.,false,"Village Council meeting on 2020-11-04, agenda item 3 (Resolution): Adopted Resolution 2020 Source: https://estero-fl.gov/wp-content/uploads/library-ada/minutes/2020%20Minutes/Council/11042020%20Council%20Meeting%20Minutes.pdf"
council:527,council,agenda_item,AgendaItemLocation,131,527,445,Village Council,Regular Meeting,Village Council,2020-09-09,2020,5:30 pm,Legacy Church,Accepted,7,Contract Approval,contract_approval,infrastructure,Corkscrew Road,Corkscrew Road/Puente Lane Traffic Signal Interlocal Agreement - Modified,Corkscrew Road/Puente Lane Traffic Signal Interlocal Agreement - Modified. Action: Approved the modified Interlocal Agreement between Lee County and the Village of Estero for Corkscrew Road/Puente Lane Traffic Signal with the two corrections to the contract. Authorize the Mayor to execute this agreement on behalf of the Village of Estero Council including any minor revisions to the agreement requested by Lee County which do not alter the scope or intent of the agreement,,,,,,Approved the modified Interlocal Agreement between Lee County and the Village of Estero for Corkscrew Road/Puente Lane Traffic Signal with the two corrections to the contract. Authorize the Mayor to execute this agreement on behalf of the Village of Estero Council including any minor revisions to the agreement requested by Lee County which do not alter the scope or intent of the agreement,Approved the modified Interlocal Agreement between Lee County and the Village of Estero for Corkscrew Road/Puente Lane Traffic Signal with the two corrections to the contract. Authorize the Mayor to execute this agreement on behalf of the Village of Estero Council including any minor revisions to the agreement requested by Lee County which do not alter the scope or intent of the agreement,Approved the modified Interlocal Agreement between Lee County and the Village of Estero for Corkscrew Road/Puente Lane Traffic Signal with the two corrections to the contract. Authorize the Mayor to execute this agreement on behalf of the Village of Estero Council including any minor revisions to the agreement requested by Lee County which do not alter the scope or intent of the agreement,,,Detected,,,,"Corkscrew Road & Puente Lane, Estero, FL","Corkscrew Road & Puente Lane, Estero, FL","Corkscrew Road & Puente Lane, Estero, FL",26.431386394627,-81.784740920078,1.0,item_address,,https://estero-fl.gov/wp-content/uploads/library-ada/minutes/2020%20Minutes/Council/09092020%20Council%20Meeting%20Minutes.pdf,09092020 Council Meeting Minutes.pdf,pdf_extraction:council,low,true,Review item 521: weak or fallback extraction.; Review item 522: weak or fallback extraction.; Review item 523: weak or fallback extraction.; Review item 524: weak or fallback extraction.; Review item 525: weak or fallback extraction.; Review item 528: weak or fallback extraction.; Review item 529: weak or fallback extraction.,false,"Village Council meeting on 2020-09-09, agenda item 7 (Contract Approval): Approved the modified Interlocal Agreement between Lee County and the Village of Estero for Corkscrew Road/Puente Lane Traffic Signal with the two corrections to the contract. Authorize the Mayor to execute this agreement on behalf of the Village of Estero Council including any minor revisions to the agreement requested by Lee County which do not alter the scope or intent of the agreement Source: https://estero-fl.gov/wp-content/uploads/library-ada/minutes/2020%20Minutes/Council/09092020%20Council%20Meeting%20Minutes.pdf"
