motion_id,item_id,motion_text,proposed_by,seconded_by,outcome,vote_yes,vote_no,vote_abstain,created_at
380,616,Approved the Consent Agenda,,,Approved the Consent Agenda,2,,,
381,623,Approved motion to permit Councilmember Wilson to participate remotely in Zoom Presentation,,,Approved motion to permit Councilmember Wilson to participate remotely in Zoom Presentation,,,,
382,624,Approved agenda with the deletion of Action Item 7e,,,Approved agenda with the deletion of Action Item 7e,,,,
383,625,Approved the Consent Agenda,,,Approved the Consent Agenda,,,,
384,626,"Adopted Resolution No. 2022-08 to purchase the 10-acre vacant parcel, commonly known as ""River Oaks"" at the east end of Broadway Avenue",,,"Adopted Resolution No. 2022-08 to purchase the 10-acre vacant parcel, commonly known as ""River Oaks"" at the east end of Broadway Avenue",,,,
385,628,"Approved the contract EC 2020-48 STA 10 with CW3 Engineering to provide design and permitting services for the Williams Road Bicycle/Pedestrian Improvements Project in the amount of $358,790, approve a contingency fund amount of $36,000 (an amount equal to 10% of the total project cost) to cover unforeseen circumstances which may occur, and authorize the Village Manager to execute the contract with CW3 Engineering and any other related ancillary documents on behalf of the Village Council",,,"Approved the contract EC 2020-48 STA 10 with CW3 Engineering to provide design and permitting services for the Williams Road Bicycle/Pedestrian Improvements Project in the amount of $358,790, approve a contingency fund amount of $36,000 (an amount equal to 10% of the total project cost) to cover unforeseen circumstances which may occur, and authorize the Village Manager to execute the contract with CW3 Engineering and any other related ancillary documents on behalf of the Village Council",,,,
386,629,Approved Ben Hill Griffin Parkway Improvements contracts with Bruce Howard and Associates under EC2020-42 STA - 07 and CW3 Engineering under EC2020-48 STA - 09 to perform landscape architecture and engineering services for the proposed improvements along Ben Hill Griffin Parkway from Corkscrew Road to Estero Parkway,,,Approved Ben Hill Griffin Parkway Improvements contracts with Bruce Howard and Associates under EC2020-42 STA - 07 and CW3 Engineering under EC2020-48 STA - 09 to perform landscape architecture and engineering services for the proposed improvements along Ben Hill Griffin Parkway from Corkscrew Road to Estero Parkway,,,,
387,633,"Approved to permit Councilmember Wilson to participate remotely in Zoom Presentation. Final Action Agenda/Minutes are supplemented by audio and video recordings of the meetings, as well as transcripts. Video recordings of Village Council meetings from June 8, 2016 forward, as well agendas, staff reports, resolutions, ordinances, and other documents related to the meetings can be viewed online at https://estero-fl.gov/agendas/ at the corresponding meeting date",,,"Approved to permit Councilmember Wilson to participate remotely in Zoom Presentation. Final Action Agenda/Minutes are supplemented by audio and video recordings of the meetings, as well as transcripts. Video recordings of Village Council meetings from June 8, 2016 forward, as well agendas, staff reports, resolutions, ordinances, and other documents related to the meetings can be viewed online at https://estero-fl.gov/agendas/ at the corresponding meeting date",,,,
388,634,Approved agenda,,,Approved agenda,,,,
389,635,Approved the Consent Agenda,,,Approved the Consent Agenda,,,,
390,636,Approved the Interlocal Agreement and forward to Lee County Port Authority for their approval and signature,,,Approved the Interlocal Agreement and forward to Lee County Port Authority for their approval and signature,,,,
391,637,Approved Resolution 2021-13,,,Approved Resolution 2021-13,,,,
392,638,"Passed First Reading and set Second Reading for May 5, 2021 at 9:30 a.m",,,"Passed First Reading and set Second Reading for May 5, 2021 at 9:30 a.m",,,,
393,639,Approved Ordinance 2021-03,,,Approved Ordinance 2021-03,,,,
394,644,"Mr. Ribble moved approval, seconded by Mr. Brown, called and carried",,,"Mr. Ribble moved approval, seconded by Mr. Brown, called and carried",,,,
395,645,"Mr. Ribble moved to draw the names of the elected candidates from a hat to assign the term lengths, seconded by Ms. Errington, called and carried",,,"Mr. Ribble moved to draw the names of the elected candidates from a hat to assign the term lengths, seconded by Ms. Errington, called and carried",,,,
396,646,"Ms. Errington moved to adopt the resolution with those six names and specified terms, seconded by Mr. Brown, called and carried",,,"Ms. Errington moved to adopt the resolution with those six names and specified terms, seconded by Mr. Brown, called and carried",,,,
397,647,"Mr. Ribble moved approval in the amount of $7,600.26, seconded by Mr. Brown. Following confirmation that this would be the final bill, the motion was called and carried",,,"Mr. Ribble moved approval in the amount of $7,600.26, seconded by Mr. Brown. Following confirmation that this would be the final bill, the motion was called and carried",,,,
398,648,"Mr. Brown moved approval, seconded by Vice-Mayor Levitan, called and carried",,,"Mr. Brown moved approval, seconded by Vice-Mayor Levitan, called and carried",,,,
399,649,"Approved agenda with noting a replacement of Resolution for 7(e), 2024- 08 that has been added to the desk packet as the consultants Final Action Agenda/Minutes are supplemented by audio and video recordings of the meetings, as well as transcripts. Video recordings of Village Council meetings from June 8, 2016, forward, as well as agendas, staff reports, resolutions, ordinances, and other documents related to the meetings can be viewed online at https://estero-fl.gov/agendas/ at the corresponding meeting date. recommended more detailed language to the resolution but the substance has not changed",,,"Approved agenda with noting a replacement of Resolution for 7(e), 2024- 08 that has been added to the desk packet as the consultants Final Action Agenda/Minutes are supplemented by audio and video recordings of the meetings, as well as transcripts. Video recordings of Village Council meetings from June 8, 2016, forward, as well as agendas, staff reports, resolutions, ordinances, and other documents related to the meetings can be viewed online at https://estero-fl.gov/agendas/ at the corresponding meeting date. recommended more detailed language to the resolution but the substance has not changed",,,,
400,650,Approved consent agenda,,,Approved consent agenda,,,,
401,651,"Approved Construction Manager at Risk agreement between Village of Estero and Manhattan Construction, Inc. for Williams Road and Atlantic Gulf Blvd Intersection Project and to authorize the Village Manager to execute the agreement and any related documents or amendments as may be necessary, except for the Guaranteed Maximum Price amendment, which will be approved by Council, at a later date",,,"Approved Construction Manager at Risk agreement between Village of Estero and Manhattan Construction, Inc. for Williams Road and Atlantic Gulf Blvd Intersection Project and to authorize the Village Manager to execute the agreement and any related documents or amendments as may be necessary, except for the Guaranteed Maximum Price amendment, which will be approved by Council, at a later date",,,,
402,652,"Approved Construction Manager at Risk agreement between Village of Estero and Chris-Tel Construction, Inc. for the Sandy Lane Bike/Ped Improvements Project and to authorize the Village Manager to execute the agreement with an effective date of July 1, 2024 and any related documents or amendments as may be necessary, except for the Guaranteed Maximum Price amendment, which will be approved by Council, at a later date",,,"Approved Construction Manager at Risk agreement between Village of Estero and Chris-Tel Construction, Inc. for the Sandy Lane Bike/Ped Improvements Project and to authorize the Village Manager to execute the agreement with an effective date of July 1, 2024 and any related documents or amendments as may be necessary, except for the Guaranteed Maximum Price amendment, which will be approved by Council, at a later date",,,,
403,653,Approved of the attached Resolution will give credibility to the Village of Estero interest in this acquisition. It can also be used as the necessary financial match for Federal and State grants,,,Approved of the attached Resolution will give credibility to the Village of Estero interest in this acquisition. It can also be used as the necessary financial match for Federal and State grants,,,,
404,654,Adopted Resolution No. 2024-07,,,Adopted Resolution No. 2024-07,,,,
405,655,Approved Resolution No. 2024-08 authorizing the Village Manager to perform various duties including accepting and authorizing CDBG-DR grants from HUD and administered by Lee County,,,Approved Resolution No. 2024-08 authorizing the Village Manager to perform various duties including accepting and authorizing CDBG-DR grants from HUD and administered by Lee County,,,,
406,656,Approved Resolution No. 2024-09 Excessive Force Policy,,,Approved Resolution No. 2024-09 Excessive Force Policy,,,,
407,657,"Approved Ordinance No. 2024-05 with amending condition #4 to state, ""The tower will not contain any lights on the tower including the top, unless lighting is required by any agency with jurisdiction to require lighting, but will be taped consistent with Land Development Code.""",,,"Approved Ordinance No. 2024-05 with amending condition #4 to state, ""The tower will not contain any lights on the tower including the top, unless lighting is required by any agency with jurisdiction to require lighting, but will be taped consistent with Land Development Code.""",,,,
408,658,"Approved the agenda as revised, adding agenda item 5 (e)",,,"Approved the agenda as revised, adding agenda item 5 (e)",1,0,1,
409,659,Approved the Consent Agenda,,,Approved the Consent Agenda,1,1,,
410,660,Approved the proposed lease amendment,,,Approved the proposed lease amendment,1,,,
411,661,Adopted the Village Council Liaison Assignments and Areas of Strategic Concern as revised,,,Adopted the Village Council Liaison Assignments and Areas of Strategic Concern as revised,1,,,
412,662,"Adopted Resolution No. 2017-11, as amended",,,"Adopted Resolution No. 2017-11, as amended",1,,,
413,663,"Continued the agenda item to May 31, 2017",,,"Continued the agenda item to May 31, 2017",1,,,
414,668,"No formal action recorded. Bonus Density Program for Land Acquisition Village Manager Sarkozy explained that this issue was a holdover from pre- incorporation; Lee County routinely granted bonus density. Community Development Director Gibbs explained that three Estero projects were approved by the county that included bonus density in a rezoning application. The County's bonus density program allows affordable units to be constructed on-site, or provide a payment in lieu of constructing units on-site to be placed in an affordable housing fund. The Village's land use attorney prepared a memo opining that this program would not be applicable in the Village unless and until the Village adopted its own program, or entered into an interlocal agreement with Lee County to use its program. A second option that had been discussed as an alternative was establishing a bonus density program for land acquisition to provide fut",,,"No formal action recorded. Bonus Density Program for Land Acquisition Village Manager Sarkozy explained that this issue was a holdover from pre- incorporation; Lee County routinely granted bonus density. Community Development Director Gibbs explained that three Estero projects were approved by the county that included bonus density in a rezoning application. The County's bonus density program allows affordable units to be constructed on-site, or provide a payment in lieu of constructing units on-site to be placed in an affordable housing fund. The Village's land use attorney prepared a memo opining that this program would not be applicable in the Village unless and until the Village adopted its own program, or entered into an interlocal agreement with Lee County to use its program. A second option that had been discussed as an alternative was establishing a bonus density program for land acquisition to provide fut",,,,
415,669,Approved agenda,,,Approved agenda,,,,
416,670,Approved the Consent Agenda,,,Approved the Consent Agenda,,,,
417,671,"Approved the award of Supplemental Task Authorization 05 to Contract EC 2022-21 to Banks Engineering, Inc. for the See See Street Utility Expansion Design and Permitting of $240,500, approve a $24,000 contingency (10%) for additional services that may be required to complete the project, and authorize the Village Manager to sign the STA and other additional implementing documents within the scope of the STA on behalf of the Village of Estero Council",,,"Approved the award of Supplemental Task Authorization 05 to Contract EC 2022-21 to Banks Engineering, Inc. for the See See Street Utility Expansion Design and Permitting of $240,500, approve a $24,000 contingency (10%) for additional services that may be required to complete the project, and authorize the Village Manager to sign the STA and other additional implementing documents within the scope of the STA on behalf of the Village of Estero Council",,,,
418,672,"Approved Village Staff's recommendation to select all three firms, Atkins, Legacy Professional Solutions and RVi Planning + Landscape Architecture, to provide supplemental staffing to the Village of Estero and authorize staff to negotiate contracts with one or more of the firms to provide supplemental staffing",,,"Approved Village Staff's recommendation to select all three firms, Atkins, Legacy Professional Solutions and RVi Planning + Landscape Architecture, to provide supplemental staffing to the Village of Estero and authorize staff to negotiate contracts with one or more of the firms to provide supplemental staffing",,,,
419,673,Approved Resolution No. 2023-10,,,Approved Resolution No. 2023-10,,,,
420,674,"Passed first reading of Ordinance No. 2023-05 and set second reading for May 17, 2023",,,"Passed first reading of Ordinance No. 2023-05 and set second reading for May 17, 2023",,,,
421,678,"Approved the agenda as revised by updated agenda provided, adding agenda item 8 (c)",,,"Approved the agenda as revised by updated agenda provided, adding agenda item 8 (c)",1,,,
422,679,Approved the Consent Agenda,,,Approved the Consent Agenda,2,,,
423,680,"Approved first reading of Ordinance No. 2016-05 and advanced to second reading on May 18, 2016",,,"Approved first reading of Ordinance No. 2016-05 and advanced to second reading on May 18, 2016",2,,,
424,681,"Awarded RFQ 2016-01 - Comprehensive Plan to LaRue Planning & Management Services, Inc. and authorized the Village Manager, with the assistance of staff, to negotiate a contract to be reviewed by Council at a later date",,,"Awarded RFQ 2016-01 - Comprehensive Plan to LaRue Planning & Management Services, Inc. and authorized the Village Manager, with the assistance of staff, to negotiate a contract to be reviewed by Council at a later date",2,,,
425,687,Approved agenda,,,Approved agenda,,,,
426,688,Approved the Consent Agenda,,,Approved the Consent Agenda,,,,
427,690,"Approved Misc. Contractor Services contract EC 2019-59 STA 08 with Cougar Contracting, LLC for $52,815 for the repair of sidewalks along Via Coconut Point and Williams Road, approve a contingency fund amount of $5,300 (an amount equal to 10% of the total project cost) to cover unforeseen circumstances which may occur, and authorize the Village Manager to execute the contract documents on behalf of the Village of Estero Council",,,"Approved Misc. Contractor Services contract EC 2019-59 STA 08 with Cougar Contracting, LLC for $52,815 for the repair of sidewalks along Via Coconut Point and Williams Road, approve a contingency fund amount of $5,300 (an amount equal to 10% of the total project cost) to cover unforeseen circumstances which may occur, and authorize the Village Manager to execute the contract documents on behalf of the Village of Estero Council",,,,
428,691,Approved Resolution No. 2022-07 which amends Resolution No. 2015-68,,,Approved Resolution No. 2022-07 which amends Resolution No. 2015-68,,,,
429,692,"Passed first reading of Ordinance 2022-02 and set second reading for May 18, 2022",,,"Passed first reading of Ordinance 2022-02 and set second reading for May 18, 2022",,,,
430,695,Approved motion to move 6a to the May 19th or June 2nd meeting and approve agenda,,,Approved motion to move 6a to the May 19th or June 2nd meeting and approve agenda,,,,
431,696,Approved the Consent Agenda,,,Approved the Consent Agenda,,,,
432,697,"Approved the acceptance of North Commons Drive from Coconut Road to Pelican Colony Boulevard for maintenance as a Village-maintained road, issue impact fee credits in the amount of $325,000 upon acceptance of the road, and approve Resolution No. 2021-11 as modified to include landscaping, and revision to the end of Section 2 to add language ""including a letter issuing impact fee credits""",,,"Approved the acceptance of North Commons Drive from Coconut Road to Pelican Colony Boulevard for maintenance as a Village-maintained road, issue impact fee credits in the amount of $325,000 upon acceptance of the road, and approve Resolution No. 2021-11 as modified to include landscaping, and revision to the end of Section 2 to add language ""including a letter issuing impact fee credits""",,,,
433,698,Approved council liaison assignments,,,Approved council liaison assignments,,,,
434,699,Approved Ordinance No. 2021-05,,,Approved Ordinance No. 2021-05,,,,
435,700,Approved Ordinance No. 2021-06,,,Approved Ordinance No. 2021-06,,,,
436,706,Approved agenda,,,Approved agenda,,,,
437,707,Approved consent agenda,,,Approved consent agenda,,,,
438,708,Approved sending notification letter and affidavit signed by Mayor to Florida Department of Commerce,,,Approved sending notification letter and affidavit signed by Mayor to Florida Department of Commerce,,,,
439,709,"Approved the award of Contract 25035 with LandDesign, Inc. to prepare the Village of Estero Eco-Historic planning study for $430,000, approve a $43,000 contingency for additional services that may be required to complete the project, and authorize the Village Manager to sign the contract and other additional implementing documents within the scope of the contract on behalf of the Village of Estero Council",,,"Approved the award of Contract 25035 with LandDesign, Inc. to prepare the Village of Estero Eco-Historic planning study for $430,000, approve a $43,000 contingency for additional services that may be required to complete the project, and authorize the Village Manager to sign the contract and other additional implementing documents within the scope of the contract on behalf of the Village of Estero Council",,,,
440,710,"Approved the award of landscaping, mowing and irrigation services for Village roadways for P & T Lawn & Tractor, for an amount not to exceed $2,896,517.52 annually, approve a $200,000 Contingency for additional services that may be required to complete the project, and authorize the Village Manager to sign the purchase order and other additional implementing documents on behalf of the Village of Estero Council",,,"Approved the award of landscaping, mowing and irrigation services for Village roadways for P & T Lawn & Tractor, for an amount not to exceed $2,896,517.52 annually, approve a $200,000 Contingency for additional services that may be required to complete the project, and authorize the Village Manager to sign the purchase order and other additional implementing documents on behalf of the Village of Estero Council",,,,
441,711,"Approved awards of landscaping, mowing and irrigation services for Village roadways for Mainscape, Inc., in an amount not to exceed $1,432,600 annually, and to P & T Lawn & Tractor, for an amount not to exceed $581,107 annually",,,"Approved awards of landscaping, mowing and irrigation services for Village roadways for Mainscape, Inc., in an amount not to exceed $1,432,600 annually, and to P & T Lawn & Tractor, for an amount not to exceed $581,107 annually",,,,
442,712,"Approved GMP Addendum 2 for contract EC 2024 - 12 CMAR for Wright Construction to complete the site work and utility installation for the Estero Entertainment Campus for $ 9,536,910 and authorize the Village Manager to sign the contract and other additional implementation documents within the scope of the GMP addendum on behalf of the Village of Estero Council",,,"Approved GMP Addendum 2 for contract EC 2024 - 12 CMAR for Wright Construction to complete the site work and utility installation for the Estero Entertainment Campus for $ 9,536,910 and authorize the Village Manager to sign the contract and other additional implementation documents within the scope of the GMP addendum on behalf of the Village of Estero Council",,,,
443,717,"No formal action recorded. Establishing a Policy Regarding Council Approved Proclamations Staff Presentation/Comments Steve Sarkozy, Village Manager Robert Eschenfelder, Village Attorney Carol Sacco. Village Clerk Council Questions or Comments Councilmembers McLain, Fayhee, Lopez, Vice Mayor Zalucki, and Mayor Ribble Public Comments None",,,"No formal action recorded. Establishing a Policy Regarding Council Approved Proclamations Staff Presentation/Comments Steve Sarkozy, Village Manager Robert Eschenfelder, Village Attorney Carol Sacco. Village Clerk Council Questions or Comments Councilmembers McLain, Fayhee, Lopez, Vice Mayor Zalucki, and Mayor Ribble Public Comments None",,,,
444,718,"Mr. Ribble moved approval, seconded by Ms. Errington, called and carried",,,"Mr. Ribble moved approval, seconded by Ms. Errington, called and carried",,,,
445,719,"Mr. Boesch moved approval of the assignments as presented, seconded by Mr. Brown, called and carried",,,"Mr. Boesch moved approval of the assignments as presented, seconded by Mr. Brown, called and carried",,,,
446,721,"Mr. Ribble moved to designate Attorney Saunders and Gray Robinson as permanent Village Attorney, seconded by Mr. Brown. Attorney Saunders reviewed the fee schedule for normal and additional activities, followed by discussion of the need for lobbyists. The Mayor called for public comment, and the following individual came forward: Old Estero resident, Patti Whitehead - potential conflict of interest After Attorney Saunders responded that the services provided to Lee County were entirely different from those provided to the Village, the motion was called and carried",,,"Mr. Ribble moved to designate Attorney Saunders and Gray Robinson as permanent Village Attorney, seconded by Mr. Brown. Attorney Saunders reviewed the fee schedule for normal and additional activities, followed by discussion of the need for lobbyists. The Mayor called for public comment, and the following individual came forward: Old Estero resident, Patti Whitehead - potential conflict of interest After Attorney Saunders responded that the services provided to Lee County were entirely different from those provided to the Village, the motion was called and carried",,,,
447,722,"Mr. Levitan moved to direct Mr. Lombardi to work with a Council liaison to develop recommendations for a process, with input from other Council members, seconded by Mr. Brown. The Mayor called for public input, and the following individual came forward: Bella Terra resident, Mark Novitski - suggestions about furniture and design The motion was called and carried",,,"Mr. Levitan moved to direct Mr. Lombardi to work with a Council liaison to develop recommendations for a process, with input from other Council members, seconded by Mr. Brown. The Mayor called for public input, and the following individual came forward: Bella Terra resident, Mark Novitski - suggestions about furniture and design The motion was called and carried",,,,
448,723,"Mr. Levitan moved to direct the Village Attorney to develop a Special Magistrate Ordinance; seconded by Mr. Boesch. The Mayor called for public input, and the following individuals came forward: Old Estero resident, Patty Whitehead - billboards Stoneybrook resident, Gary Israel - communication with business owners After Council members and Attorney Saunders addressed the speakers' concerns, the motion was called and carried",,,"Mr. Levitan moved to direct the Village Attorney to develop a Special Magistrate Ordinance; seconded by Mr. Boesch. The Mayor called for public input, and the following individuals came forward: Old Estero resident, Patty Whitehead - billboards Stoneybrook resident, Gary Israel - communication with business owners After Council members and Attorney Saunders addressed the speakers' concerns, the motion was called and carried",,,,
449,724,"continued regarding the projected surplus shown on the ""Budget Summary"" page of a3-page handout entitled ""Village of Estero - Budget Fiscal Year 2014-2015"" (copy on file); expenses resulting from summer storms",,,"continued regarding the projected surplus shown on the ""Budget Summary"" page of a3-page handout entitled ""Village of Estero - Budget Fiscal Year 2014-2015"" (copy on file); expenses resulting from summer storms",,,,
450,733,"Mr. Ribble moved approval, seconded by Mr. Brown, called and carried",,,"Mr. Ribble moved approval, seconded by Mr. Brown, called and carried",,,,
