motion_id,item_id,motion_text,proposed_by,seconded_by,outcome,vote_yes,vote_no,vote_abstain,created_at
759,1158,Adopted Resolution No. 2016-17 with corrections to minor typos and inclusion of additional bullet points: Changing the name of the Koreshan State Park to Estero River/Koreshan Historic Site State Park; Exploring environmental research facilities and environmental restoration through the Florida Gulf Coast University Environmental Studies Group,,,Adopted Resolution No. 2016-17 with corrections to minor typos and inclusion of additional bullet points: Changing the name of the Koreshan State Park to Estero River/Koreshan Historic Site State Park; Exploring environmental research facilities and environmental restoration through the Florida Gulf Coast University Environmental Studies Group,1,,,
760,1163,"Approved motion to permit Councilmembers Wilson and Ward to participate remotely in Zoom Presentation. Final Action Agenda/Minutes are supplemented by audio and video recordings of the meetings, as well as transcripts. Video recordings of Village Council meetings from June 8, 2016, forward, as well as agendas, staff reports, resolutions, ordinances, and other documents related to the meetings can be viewed online at https://estero-fl.gov/agendas/ at the corresponding meeting date",,,"Approved motion to permit Councilmembers Wilson and Ward to participate remotely in Zoom Presentation. Final Action Agenda/Minutes are supplemented by audio and video recordings of the meetings, as well as transcripts. Video recordings of Village Council meetings from June 8, 2016, forward, as well as agendas, staff reports, resolutions, ordinances, and other documents related to the meetings can be viewed online at https://estero-fl.gov/agendas/ at the corresponding meeting date",,,,
761,1164,Approved agenda with tabling 8b,,,Approved agenda with tabling 8b,,,,
762,1165,Approved the Consent Agenda,,,Approved the Consent Agenda,,,,
763,1166,Approved Comprehensive Annual Financial Report,,,Approved Comprehensive Annual Financial Report,,,,
764,1167,Adopted Resolution No. 2022-20,,,Adopted Resolution No. 2022-20,,,,
765,1168,Adopted Resolution No. 2022-18,,,Adopted Resolution No. 2022-18,,,,
766,1169,"Passed first reading of Ordinance No. 2022-05 with the map 2A-1 and set second reading for July 20, 2022",,,"Passed first reading of Ordinance No. 2022-05 with the map 2A-1 and set second reading for July 20, 2022",,,,
767,1170,Approved motion to transmit Comprehensive Plan Amendment and Ordinance No. 2022-06 to state review agency,,,Approved motion to transmit Comprehensive Plan Amendment and Ordinance No. 2022-06 to state review agency,,,,
768,1171,Passed Ordinance No. 2022-07 on the first reading,,,Passed Ordinance No. 2022-07 on the first reading,,,,
769,1172,Passed first reading of Ordinance No. 2022-08,,,Passed first reading of Ordinance No. 2022-08,,,,
770,1173,"Passed motion to move Capital Improvement Hearing and Resolution 2022-19 on to second public hearing on July 20, 2022",,,"Passed motion to move Capital Improvement Hearing and Resolution 2022-19 on to second public hearing on July 20, 2022",,,,
771,1174,Approved Ordinance No. 2022-04,,,Approved Ordinance No. 2022-04,,,,
772,1178,Motion to permit Councilmembers Ward and Wilson to participate remotely in Zoom Presentation,,,Motion to permit Councilmembers Ward and Wilson to participate remotely in Zoom Presentation,7,0,,
773,1179,Approved agenda,,,Approved agenda,,,,
774,1180,"Approved the consent agenda with the correction to the June 16, 2021 minutes",,,"Approved the consent agenda with the correction to the June 16, 2021 minutes",,,,
775,1181,Approved Comprehensive Annual Financial Report,,,Approved Comprehensive Annual Financial Report,,,,
776,1182,"Authorized the Village Manager to execute the attached three letters of engagement, or similarly priced alternatives, and other invoices related to these services",,,"Authorized the Village Manager to execute the attached three letters of engagement, or similarly priced alternatives, and other invoices related to these services",,,,
777,1184,"Approved the lien mitigation request from Ms. Hernandez releasing any outstanding liens against the Property in exchange for payment of a reduced fine of $5,000.00 and $327.20 for administrative cost",,,"Approved the lien mitigation request from Ms. Hernandez releasing any outstanding liens against the Property in exchange for payment of a reduced fine of $5,000.00 and $327.20 for administrative cost",,,,
778,1185,"Passed first reading of Ordinance 2021-09 and set second reading for July 21, 2021",,,"Passed first reading of Ordinance 2021-09 and set second reading for July 21, 2021",,,,
779,1188,Approved the Consent Agenda,,,Approved the Consent Agenda,,,,
780,1189,"Approved the Supplemental Task Authorization (STA)-02 under CN 2020-01 Miscellaneous Professional Services for Johnson Engineering, Inc. to perform a suite of services for the Village ofEstero Water Quality Monitoring Assistance, and authorize the Village Manager to sign the STA and other additional implementing documents",,,"Approved the Supplemental Task Authorization (STA)-02 under CN 2020-01 Miscellaneous Professional Services for Johnson Engineering, Inc. to perform a suite of services for the Village ofEstero Water Quality Monitoring Assistance, and authorize the Village Manager to sign the STA and other additional implementing documents",,,,
781,1190,"Approved Supplemental Task Authorization (STA)-14 under CN 2020-01 Miscellaneous Professional Services to Johnson Engineering, Inc.to perform a suite of design services for the Coconut Road Improvements Study, authorize the Village Manager to sign the STA and other additional implementing documents within the scope of the STA on behalf of the Village of Estero Council, and adopt Resolution No. 2020-11 for Fiscal Year 2019-2020 budget amendment",,,"Approved Supplemental Task Authorization (STA)-14 under CN 2020-01 Miscellaneous Professional Services to Johnson Engineering, Inc.to perform a suite of design services for the Coconut Road Improvements Study, authorize the Village Manager to sign the STA and other additional implementing documents within the scope of the STA on behalf of the Village of Estero Council, and adopt Resolution No. 2020-11 for Fiscal Year 2019-2020 budget amendment",,,,
782,1191,"Passed first reading of Ordinance No. 2020-05 and schedule second reading/public hearing for July 22, 2020",,,"Passed first reading of Ordinance No. 2020-05 and schedule second reading/public hearing for July 22, 2020",,,,
783,1192,Motion Failed,,,Motion Failed,,,,
784,1193,"Approved to move to second public hearing on July 22, 2020 and remove the Estero River Preserve line item from 2020-21 CIP and instead moved to 2021-22 budget",,,"Approved to move to second public hearing on July 22, 2020 and remove the Estero River Preserve line item from 2020-21 CIP and instead moved to 2021-22 budget",,,,
785,1194,Approved the appointment of Mayor Ribble as the liaison to Bonita Springs on the Pelican Landing Raptor Bay Rezoning,,,Approved the appointment of Mayor Ribble as the liaison to Bonita Springs on the Pelican Landing Raptor Bay Rezoning,,,,
786,1197,"No formal action recorded. Terminate as of July 8, 2020 CN 2018-02 Miscellaneous Professional Services to allow for the immediate use of the firms approved under CN 2020-01",,,"No formal action recorded. Terminate as of July 8, 2020 CN 2018-02 Miscellaneous Professional Services to allow for the immediate use of the firms approved under CN 2020-01",,,,
787,1199,Approved the monument sign subject to further negotiations on the location,,,Approved the monument sign subject to further negotiations on the location,6,1,,
788,1200,"Approved Development Order with staff recommendations and the following conditions; applicant will work with staff to minimize the use of green screens and incorporate other architectural elements to break up the long walls and use of green screens where appropriate, and no deliveries earlier than 7 am and no later than 9 pm",,,"Approved Development Order with staff recommendations and the following conditions; applicant will work with staff to minimize the use of green screens and incorporate other architectural elements to break up the long walls and use of green screens where appropriate, and no deliveries earlier than 7 am and no later than 9 pm",7,1,,
789,1202,A motion to approve the consent agenda was made and duly passed,,,A motion to approve the consent agenda was made and duly passed,,,,
790,1205,"Approved continuance to the August 13, 2024, Planning Zoning and Design Board Meeting",,,"Approved continuance to the August 13, 2024, Planning Zoning and Design Board Meeting",7,0,0,
791,1206,A motion to approve the consent agenda was made and duly passed,,,A motion to approve the consent agenda was made and duly passed,,,,
792,1207,continued that Ms,,,continued that Ms,,,,
793,1210,"Councilmember Ribble moved approval of the agenda as amended, seconded by Councilmember Errington, called and carried",,,"Councilmember Ribble moved approval of the agenda as amended, seconded by Councilmember Errington, called and carried",,,,
794,1211,Approved Resolution 2023-01,,,Approved Resolution 2023-01,6,1,0,
795,1212,"Approved deviation from Section 5-604 E1 for 4000K lighting on the basis that it will be an improvement to the adjacent residents, and the current situation was not created by the applicant",,,"Approved deviation from Section 5-604 E1 for 4000K lighting on the basis that it will be an improvement to the adjacent residents, and the current situation was not created by the applicant",5,1,0,
796,1213,"Approved Development Order for a mixed-use project with 330 multi- family units and commercial buildings, amenities and supporting infrastructure subject to the staff stipulations, and the monument sign design is approved but the sign must meet the code standards",,,"Approved Development Order for a mixed-use project with 330 multi- family units and commercial buildings, amenities and supporting infrastructure subject to the staff stipulations, and the monument sign design is approved but the sign must meet the code standards",7,1,,
797,1214,A motion to approve the consent agenda was made and duly passed,,,A motion to approve the consent agenda was made and duly passed,,,,
798,1216,Approved the Resolution expanding the COP premises as described with the five conditions in the staff recommendation with the addition of the sixth condition of a minimum of 60- inches clear space be cleared for a walking area between the curb and the barrier of the outdoor seating,,,Approved the Resolution expanding the COP premises as described with the five conditions in the staff recommendation with the addition of the sixth condition of a minimum of 60- inches clear space be cleared for a walking area between the curb and the barrier of the outdoor seating,7,1,,
799,1220,A motion to approve the consent agenda was made and duly passed,,,A motion to approve the consent agenda was made and duly passed,,,,
800,1223,"Approved the agenda, added agenda item 4",,,"Approved the agenda, added agenda item 4",,,,
801,1224,Adopted Resolution No. 2016-08,,,Adopted Resolution No. 2016-08,1,,,
802,1225,Appointed Councilmember Bill Ribble as the Council liaison to the County Commission for purposes of facilitating an agreement and bringing it back to the Council for discussion and vote,,,Appointed Councilmember Bill Ribble as the Council liaison to the County Commission for purposes of facilitating an agreement and bringing it back to the Council for discussion and vote,1,,,
803,1226,Adopted Resolution No. 2016-19,,,Adopted Resolution No. 2016-19,1,,,
804,1227,Adopted Resolution No. 2016-20,,,Adopted Resolution No. 2016-20,1,,,
805,1229,The case was continued to a future date,,,The case was continued to a future date,1,,,
806,1230,Adopted Ordinance No. 2016-08 with revisions and additions to conditions and adopting findings,,,Adopted Ordinance No. 2016-08 with revisions and additions to conditions and adopting findings,,,,
807,1232,Approved the Development Order with the stipulation staff is given a color sample of the stone and make sure it is coordinated with base color,,,Approved the Development Order with the stipulation staff is given a color sample of the stone and make sure it is coordinated with base color,8,1,,
808,1233,Approved the Development Order with the condition of revising of the back wall,,,Approved the Development Order with the condition of revising of the back wall,8,1,,
809,1234,Approved the the Monument Sign with the condition the base will be increased to a minimum of 24 inches,,,Approved the the Monument Sign with the condition the base will be increased to a minimum of 24 inches,8,1,,
810,1235,Approved applicant's request for a continuance,,,Approved applicant's request for a continuance,8,1,,
811,1239,Motion to permit Councilmember Ward to participate remotely via Zoom and to excuse Councilmember Wilson's absence from today's meeting,,,Motion to permit Councilmember Ward to participate remotely via Zoom and to excuse Councilmember Wilson's absence from today's meeting,,,,
812,1240,Approved agenda,,,Approved agenda,,,,
813,1241,Approved Ordinance 2021-07,,,Approved Ordinance 2021-07,,,,
814,1244,"Councilmember Ribble moved to set the salary range at $135,000 to $175,000, seconded by Councilmember Brown, called and carried",,,"Councilmember Ribble moved to set the salary range at $135,000 to $175,000, seconded by Councilmember Brown, called and carried",,,,
815,1245,"Councilmember Ribble moved to accept the three names as stated, seconded by Councilmember Wilson, called and carried",,,"Councilmember Ribble moved to accept the three names as stated, seconded by Councilmember Wilson, called and carried",,,,
816,1246,"Councilmember Brown moved to adopt Resolution 2015-46, seconded by Councilmember Errington, called and carried",,,"Councilmember Brown moved to adopt Resolution 2015-46, seconded by Councilmember Errington, called and carried",,,,
817,1247,"Councilmember Ribble moved approval of the agenda, seconded by Councilmember Brown, called and carried",,,"Councilmember Ribble moved approval of the agenda, seconded by Councilmember Brown, called and carried",,,,
818,1250,Approved the agenda,,,Approved the agenda,1,1,,
819,1251,Approved the Consent Agenda,,,Approved the Consent Agenda,1,,,
820,1252,"Discussion will be continued at the second hearing on August 2, 2017",,,"Discussion will be continued at the second hearing on August 2, 2017",1,,,
821,1253,"Adopted Ordinance No. 2017-03 with the revision to the second ""Whereas"" replacing ""prior to the incorporation of the Village"" with ""prior to March 17, 2015.""",,,"Adopted Ordinance No. 2017-03 with the revision to the second ""Whereas"" replacing ""prior to the incorporation of the Village"" with ""prior to March 17, 2015.""",1,,,
822,1254,Appointed Vice Mayor Ribble as the voting delegate for the Village of Estero for the 2017 Florida League of Cities annual conference and business meeting and adopted Resolution No. 2017-17,,,Appointed Vice Mayor Ribble as the voting delegate for the Village of Estero for the 2017 Florida League of Cities annual conference and business meeting and adopted Resolution No. 2017-17,1,,,
823,1255,"Adopted Resolution No. 2017-18 authorizing the waiving of competitive bidding procedures and authorizing the Village Manager to execute an agreement with Windham Studio, Inc. for landscape design services",,,"Adopted Resolution No. 2017-18 authorizing the waiving of competitive bidding procedures and authorizing the Village Manager to execute an agreement with Windham Studio, Inc. for landscape design services",1,,,
824,1261,A motion to adjourn was made and duly passed,,,A motion to adjourn was made and duly passed,,,,
825,1262,"Approved motion to permit Councilmembers Ribble and Ward to participate remotely in Zoom Presentation. Final Action Agenda/Minutes are supplemented by audio and video recordings of the meetings, as well as transcripts. Video recordings of Village Council meetings from June 8, 2016, forward, as well as agendas, staff reports, resolutions, ordinances, and other documents related to the meetings can be viewed online at https://estero-fl.gov/agendas/ at the corresponding meeting date",,,"Approved motion to permit Councilmembers Ribble and Ward to participate remotely in Zoom Presentation. Final Action Agenda/Minutes are supplemented by audio and video recordings of the meetings, as well as transcripts. Video recordings of Village Council meetings from June 8, 2016, forward, as well as agendas, staff reports, resolutions, ordinances, and other documents related to the meetings can be viewed online at https://estero-fl.gov/agendas/ at the corresponding meeting date",,,,
826,1263,Approved agenda,,,Approved agenda,,,,
827,1264,Approved the Consent Agenda,,,Approved the Consent Agenda,,,,
828,1265,Adopted Resolution No. 2022-21,,,Adopted Resolution No. 2022-21,,,,
829,1266,Adopted Resolution No. 2022-19,,,Adopted Resolution No. 2022-19,,,,
830,1267,"Passed second reading of Ordinance No. 2022-05 with Map 2A-1 and ordinance shall take effect immediately upon adoption, for implementation for the next regular Village Council election",,,"Passed second reading of Ordinance No. 2022-05 with Map 2A-1 and ordinance shall take effect immediately upon adoption, for implementation for the next regular Village Council election",,,,
831,1268,Motion to permit Councilmember Ward to participate remotely in Zoom Presentation,,,Motion to permit Councilmember Ward to participate remotely in Zoom Presentation,7,1,,
832,1269,Approved agenda with the deletion of 6,,,Approved agenda with the deletion of 6,,,,
833,1270,Approved the consent agenda with the correction to minutes,,,Approved the consent agenda with the correction to minutes,,,,
834,1271,"Approved the committee ranking for the purchase of a Community Development Software package as follows: Number 1 -- CityView; Number 2 -- EnerGov (Tyler Technologies); Number 3 -- Accela (Silver Lining Solutions, LLC), and authorize Village Manager to negotiate a contract with the Number 1 ranked firm, CityView (pricing based on a piggyback of The City of Naples contrac",,,"Approved the committee ranking for the purchase of a Community Development Software package as follows: Number 1 -- CityView; Number 2 -- EnerGov (Tyler Technologies); Number 3 -- Accela (Silver Lining Solutions, LLC), and authorize Village Manager to negotiate a contract with the Number 1 ranked firm, CityView (pricing based on a piggyback of The City of Naples contrac",,,,
835,1272,Approved Resolution 2021-15,,,Approved Resolution 2021-15,,,,
836,1273,"Approved award Request for Bid No. RFB 2021-01, Mowing, Landscape, and Irrigation Maintenance for the Village of Estero to P & T Lawn and Tractor Service, Inc. to provide mowing, landscape, and irrigation maintenance services for US 41 Median Landscaping as provided in the contract for a one-year period, at a rate of $260,854.20 per year. Authorize the Village Manager to renegotiate and execute the renewal of this contract for three additional one-year terms under the same terms and conditions, which would include adding Estero Parkway maintenance if doing so is in the best interest of the Village of Estero, approve a contingency fund amount of $52,170 (20% contingenc",,,"Approved award Request for Bid No. RFB 2021-01, Mowing, Landscape, and Irrigation Maintenance for the Village of Estero to P & T Lawn and Tractor Service, Inc. to provide mowing, landscape, and irrigation maintenance services for US 41 Median Landscaping as provided in the contract for a one-year period, at a rate of $260,854.20 per year. Authorize the Village Manager to renegotiate and execute the renewal of this contract for three additional one-year terms under the same terms and conditions, which would include adding Estero Parkway maintenance if doing so is in the best interest of the Village of Estero, approve a contingency fund amount of $52,170 (20% contingenc",,,,
837,1274,"Approved award of Contract to Woodard & Curran in the amount not to exceed $100,000 and authorize the Village Manager to execute the contract and any other related ancillary documents on behalf of the Village of Estero Council",,,"Approved award of Contract to Woodard & Curran in the amount not to exceed $100,000 and authorize the Village Manager to execute the contract and any other related ancillary documents on behalf of the Village of Estero Council",,,,
838,1275,Approved Ordinance 2021-09,,,Approved Ordinance 2021-09,,,,
839,1276,Approved to take jurisdiction of the architectural portion of the 5/3 Bank design and schedule for the September 9th Council Meeting,,,Approved to take jurisdiction of the architectural portion of the 5/3 Bank design and schedule for the September 9th Council Meeting,,,,
840,1279,"No formal action recorded. Village Contributions/Donations Policy (Tabled by Vice Mayor Levitan at July 10, 2015 Workshop) Village Manager Peter Lombardi stated that, since the agenda item had been previously tabled, a motion by the Councilmember that tabled the item would be required to take it off the table prior to discussion. Brief discussion ensued and Vice Mayor Levitan chose not to make a motion to take it off the table",,,"No formal action recorded. Village Contributions/Donations Policy (Tabled by Vice Mayor Levitan at July 10, 2015 Workshop) Village Manager Peter Lombardi stated that, since the agenda item had been previously tabled, a motion by the Councilmember that tabled the item would be required to take it off the table prior to discussion. Brief discussion ensued and Vice Mayor Levitan chose not to make a motion to take it off the table",,,,
841,1281,"continued that $450,000 was included in the Capital Outlay line item, which included $100,000 for furniture and fixtures for the new office facility and the increase lease cost and/or build-out",,,"continued that $450,000 was included in the Capital Outlay line item, which included $100,000 for furniture and fixtures for the new office facility and the increase lease cost and/or build-out",,,,
842,1282,"Councilmember Errington moved approval of the agenda, seconded by Councilmember Ribble, called and carried",,,"Councilmember Errington moved approval of the agenda, seconded by Councilmember Ribble, called and carried",,,,
843,1283,"Councilmember Brown moved to adjourn, seconded by Councilmember Ribble, called and carried",,,"Councilmember Brown moved to adjourn, seconded by Councilmember Ribble, called and carried",,,,
844,1284,Approved the Consent Agenda,,,Approved the Consent Agenda,,,,
845,1286,Adopted Resolution No. 2020-13,,,Adopted Resolution No. 2020-13,,,,
846,1288,"Motion to approve Resolution 2020-12 Naming the Lee County Supervisor of Elections as the Village ofEstero's Qualifying Official and authority for the Village Manager to enter into the attached agreement with the Lee County Supervisor of Elections, which is an expansion of the existing interlocal agreement between the parties. MEotion by: Seconded by: Councilmember Nick Batos Vice Mayor Katy Errington Approved Resolution 2020-12 Naming the Lee County Supervisor of Elections as the Village ofEstero's Qualifying Official and authority for the Village Manager to enter into the attached agreement with the Lee County Supervisor of Elections, which is an expansion of the existing interlocal agreement between the parties",,,"Motion to approve Resolution 2020-12 Naming the Lee County Supervisor of Elections as the Village ofEstero's Qualifying Official and authority for the Village Manager to enter into the attached agreement with the Lee County Supervisor of Elections, which is an expansion of the existing interlocal agreement between the parties. MEotion by: Seconded by: Councilmember Nick Batos Vice Mayor Katy Errington Approved Resolution 2020-12 Naming the Lee County Supervisor of Elections as the Village ofEstero's Qualifying Official and authority for the Village Manager to enter into the attached agreement with the Lee County Supervisor of Elections, which is an expansion of the existing interlocal agreement between the parties",,,,
847,1290,Approved the WCI/Lennar Transportation Impact Fee Credit Agreement between WCI/Lennar and the Village ofEstero for the Pelican Colony Traffic Signal. Authorize the Mayor to execute this agreement on behalf of the Village ofEstero Council,,,Approved the WCI/Lennar Transportation Impact Fee Credit Agreement between WCI/Lennar and the Village ofEstero for the Pelican Colony Traffic Signal. Authorize the Mayor to execute this agreement on behalf of the Village ofEstero Council,,,,
848,1291,Approved the Interlocal Agreement between Lee County and the Village of Estero for Corkscrew Road/Puente Lane Traffic Signal. Authorize the Mayor to execute this agreement on behalf of the Village ofEstero Council including any minor revisions to the agreement requested by Lee County which do not alter the scope or intent of the agreement,,,Approved the Interlocal Agreement between Lee County and the Village of Estero for Corkscrew Road/Puente Lane Traffic Signal. Authorize the Mayor to execute this agreement on behalf of the Village ofEstero Council including any minor revisions to the agreement requested by Lee County which do not alter the scope or intent of the agreement,,,,
849,1292,"Approved the attached ""Inter-Local Agreement for Municipal Solid Waste Disposal, Solid Waste System Assessment and Supplemental Services"" with Lee County",,,"Approved the attached ""Inter-Local Agreement for Municipal Solid Waste Disposal, Solid Waste System Assessment and Supplemental Services"" with Lee County",,,,
